index,REQUESTID,STRSEGID,REQUESTTYP,Request_type,REQUESTDAT,Day,COMMENTS,USERTYPE,NEAR_INTER,NEAR_STR,SNA_NAME,0
0,1,2516573751825174787628,Parking on the sidewalk,Parking on the sidewalk,2/7/2018,Wed,,walks,RIDGETOP WY & OAKTREE PL,Oaktree Pl,Westwood,
1,2,3315247840033153148042,Vehicles do not yield at crosswalks,Vehicles do not yield at crosswalks,2/7/2018,Wed,Cars will NOT stop at this crosswalk and it is clearly marked.  I have even seen CPD cars stroll right through instead of yielding to pedestrians.  Please put a traffic light there or have a police officer sit there and hand out tickets.,walks,CENTRAL AV & W 8TH ST,Central Av,West End,"I agree. This occurs every day. Sometimes when you are in the crosswalk cars won't even slow down, let alone stop. The new parking spaces make it dangerous to cross at this intersection. Please place a stop sign there to make it possible for pedestrians to cross the street. Place a ""stop for pedestrian sign"" in the middle of the road, then post an officer to give tickets when vehicles do not stop. The parking spots make the cars park at an angle so that pedestrians have to walk out into the street to see if it's clear to cross. Especially if trucks are parked near the crosswalk. Not uncommon for cars to stop or even park in front of crosswalk, next to the curb on the Centennial side of the street. i echo the previous comment.
I routinely experience people not paying attention or not caring and rolling on through the crosswalk.
I have actually seen someone go though and accelerate making intentional extra noise.
make it a stop sign or ticket"
7,3,3315192865633153438678,Vehicles run red lights or stop signs,Vehicles run red lights or stop signs,2/7/2018,Wed,Cars constantly rush through here on red lights.  I'm am so tired of this.  I am so afraid to walk downtown.,walks,CENTRAL AV & W 9TH ST,W 9th St,West End,"I agree this is a very dangerous area.  A lot of people hanging in this area.  Cars will just pull up in non-parking area.  People selling drugs on the street corner. This intersection has heavy traffic 4-6pm entering N and S I75. People should stop using this intersection as a pedestrian pickup point - cars are always parked along 9th St waiting to pickup people causing chaos. DESIGNATE NO PARKING ON 9TH HERE! Walk sign too short don't get time to cross over to other side of street before it starts blinking this happens on 7th and Central Ave as well. Needs to make light longer for people to walk across street I agree. There has been at least 3 pedestrians fatally killed on this intersection! City Engineers need to revisit this issue for the safety of the pedestrians who walk this route everyday. Once vehicles get the green light heading west on W9th, the speed through, hitting high speeds within a 100 yards. Very dangerous for people pulling out of Gateway parking lot. Pedestrians crossing north or south on Central at W 9th get the light at the same time the cars on Central turning onto W 9th get the green light. Vehicles are always cutting off pedestrians in the crosswalk or cars keep moving towards pedestrians."
13,4,3313997791233153148042,Vehicles do not yield at crosswalks,Vehicles do not yield at crosswalks,2/7/2018,Wed,,walks,CENTRAL AV & W 7TH ST,W 7th St,West End,
14,5,3315247840033153148042,Vehicles run red lights or stop signs,Vehicles run red lights or stop signs,2/7/2018,Wed,,walks,CENTRAL AV & W 7TH ST,Central Av,West End,
15,6,3275178531032761205201,Lack of Visibility,Lack of Visibility,2/7/2018,Wed,"The marked crosswalk is not under a streetlight, but between two lights, which puts it in a ""blind spot"".",drives,WOOLPER AV & MCALPIN AV,McAlpin Av,Clifton,"I agree I agree, this is a really dangerous place to cross, and it is crossed by a lot of pedestrians all year long. People going north and south on Clifton regularly run the light making it a very dangerous intersection for both pedestrians as well as vehicles turning ontoClifton from Middleton. Add the school traffic and a second school to be added to the mix...."
18,7,4077751020640781120167,Speeding,Speeding,2/7/2018,Wed,There is a crosswalk here and someone is destined to get killed. Cars do not slow down. Either remove the crosswalk or add speed bumps.,walks,MORTEN ST & OBSERVATORY AV,Observatory Av,Hyde Park,"Agreed. Speeding here, so close to the intersection is just stupid. Sidewalk is so close to road with drivers barreling along. Police enforcement or at least a tall curb would help a lot. Agree!! Agreed, this is still a dangerous cross-walk.  Sometimes even if a car stops others will try to go around!  Other cities use pedestrian-activated RED LIGHTS or flashing lights.  Police enforcement.  Anything.  Cars are not stopping Yes, this is the worst stretch of Observatory. It's full-tilt by drivers. Very small physical distance between street and sidewalk. It's hellish for those on foot. I agree 100%. I work in Hyde Park and find myself crossing at this spot several times a week and it's terrifying. I have had drivers blow their horns at me. I've seen other cars nearly smash into the backs of cars that are lawfully stopped. Which street?? Please do not add speed bumps on a major city street. I believe the current crosswalk setup is more than fine and I have never felt unsafe during the many times crossing this street here."
25,8,2988295271429883721689,Lack of Visibility,Lack of Visibility,2/7/2018,Wed,"Crossing on designated walk from West to East, the Northbound Vehicles on Kirby are only visible in the middle of the intersection. 
This needs a roundabout.",walks,KIRBY AV & BRUCE AV,Kirby Av,Northside,I mean at Bruce! Or a stop sign going north at Pullan.
27,9,3315247840033153148042,Other,Other,2/7/2018,Wed,"the parking spots for the permit center at 805 central centennial 2 are very dangerous.
You have to pull into the spots nose first at an angle, when backing out, you are totally blind if there is another car parked next to you.",drives,CENTRAL AV & W 8TH ST,Central Av,West End,"Continuation of previous comment....
people are backing out into an active lane of traffic totally blinded by the cars parked next to them. No large vehicles should be allowed to park in the first 2-3 spots near the crosswalk due to pedestrian safety concerns, causes blind spots. There have been accidents due to the backing out."
30,10,3388570073933886361744,Long wait for walk signal,Long wait for walk signal,2/7/2018,Wed,Must push button to cross Vine Street and cars turning on to Vine Street do not see pedestrians crossing. I have almost been hit by cars crossing as a pedestrian multiple times.,walks,VINE ST & NIXON ST,Vine St,Corryville,"I agree! This intersection isn't pedestrian-friendly at all. I have been using this intersection on a daily basis for 10+ years. I have had at least 7 close calls, including one white box van completely blowing through a red light and honking at me to get out of the cross walk. I have also kicked two cars."
32,11,3388597991833887619909,Speeding,Speeding,2/7/2018,Wed,The ramps onto Vine Street at this intersection and at Jefferson are terrible for pedestrians. Cars go too fast and have limited visibility.,walks,VINE ST & JEFFERSON AV,E Martin Luther King Jr Dr,CUF,Agree. People run this light and almost hit other cars and pedestrians almost once a week I agree I second this all the way!
35,12,3389718039633897861051,Long wait for walk signal,Long wait for walk signal,2/7/2018,Wed,It is very frustrating that there is only one east-west crosswalk (on the north side of intersection). Cars speed through here and have limited visibility when turning.,walks,EDEN AV & GOODMAN ST,Eden Av,Corryville,
36,13,3273599531032751785490,Vehicles do not yield at crosswalks,Vehicles do not yield at crosswalks,2/7/2018,Wed,,walks,MIDDLETON AV & MCALPIN AV,McAlpin Av,Clifton,Agree. Daily as a nearby resident I watch multiple autos on a daily basis run this stop sign. Agreed Cars do not stop at  stop sign and do not yield to pedestrians I agree with this
40,14,3306957238633072832004,Crosswalk Needed,Crosswalk Needed,2/7/2018,Wed,"Despite existing crosswalks west of Lang and east of Walnut on McMicken, the majority of walkers down Lang actually cross between the east side of Lang and the west side of Walnut to cut the corner and its dangerous from left turning cars from Lang.",walks,LANG ST & WALNUT ST,E McMicken Av,Over-the-Rhine,
41,15,2970134022929701790056,Jaywalking,Jaywalking,2/7/2018,Wed,,drives,HAMILTON AV & POPE AL,Hamilton Av,Northside,Enforce jaywalking tickets. Agreed
43,16,3017668630430182556219,Speeding,Speeding,2/7/2018,Wed,,walks,CARY AV & HARBESON AV,Harbeson Av,College Hill,
44,33,3624136930836262638322,""" src=""images/11 - Sidewalk issue.png""></span>&nbsp;No Sidewalks",No Sidewalks,2/7/2018,Wed,"Many people walk along Galbraith road to go to Kroger or to work and there is no adequate, safe walkway.  The side of the road turns to mud in the fall and spring.",travels (other),W GALBRAITH RD & RIDGEVIEW DR,W Galbraith Rd,Hartwell,
45,34,4078269283540784252814,Vehicles do not yield at crosswalks,Vehicles do not yield at crosswalks,2/7/2018,Wed,,walks,SHAW AV & RRXING NORFOLK AND WESTERN,Wasson Rd,Oakley,"Agree; vehicles rarely stop. Better signage or the flashing lights system like the one in Old Montgomery may help 100% agree. I would love to have the flashing crosswalk like in old Montgomery here. I feel like I?m playing real life frogger every time I cross here. Yes! People can stand at this crosswalk for a very long time. No vehicles yield, and to cross, pedestrians have to jump into oncoming traffic agree This is a super high pedestrian area without adequate crosswalks. AGreed, including officers."
51,35,3314231842333151928656,Speeding,Speeding,2/7/2018,Wed,Once cars heading west get through light at Central and W 9th they drive at high speeds through this area.,drives,CENTRAL AV & W 9TH ST,W 9th St,West End,I agree.
52,36,3369309314033693363445,""" src=""images/09 - Failure to yield while turning.png""></span>&nbsp;Vehicles do not yield at crosswalks",Vehicles do not yield at crosswalks,2/7/2018,Wed,I have almost been hit in this crosswalk multiple times. Children walking to school are not safe.,walks,YOUNG ST & DORCHESTER AV,Young St,Mt. Auburn,
53,37,3315002986233150259734,Speeding,Speeding,2/7/2018,Wed,After the court street intersection drivers treat this street as a shortcut and drive 15-20 mph over the speed limit. There are a lot or residential homes west of central and it can be dangerous crossing the street because of this.,walks,CENTRAL AV & CLARK ST,Central Av,West End,I agree I agree
55,38,3314231842333151928656,Other,Other,2/7/2018,Wed,"Cars parked here in front of building at 4:00 pm, others are loading and unloading passengers, causing traffic backups.",drives,CENTRAL AV & W 9TH ST,W 9th St,West End,AGREED!! VERY DANGEROUS FOR PEDESTRIANS AND CARS. I agree
57,39,3306739263333069572386,Jaywalking,Jaywalking,2/7/2018,Wed,"Since walkers can?t connect to Back/Hamer through Grant Park, many use Sharp Alley instead to go around the park. As a result they don?t cross at Lang and instead jaywalk at the alley.",walks,E MCMICKEN AV & SHARP AL,E McMicken Av,Over-the-Rhine,
58,40,4249564269742499902656,Lack of Visibility,Lack of Visibility,2/7/2018,Wed,Cars are parked too closely to the intersection for easy visibility off drake,drives,DRAKE AV & WASSON RD,Wasson Rd,Oakley,"I agree, dangerous to pull out."
59,41,4254958621045450255724,Parking on the sidewalk,Parking on the sidewalk,2/7/2018,Wed,"Residents on the North side park on the street / sidewalk, in a clearly marked no parking area",walks,BROTHERTON RD & PAXTON WOODS LN,Paxton Woods Ln,Oakley,
60,42,4250514532242510965751,Vehicles do not yield at crosswalks,Vehicles do not yield at crosswalks,2/7/2018,Wed,"Drivers ignore crosswalk throughout Oakley Business district, specifically those not at stop lights.",walks,GILMORE AV & MADISON RD,Madison Rd,Oakley,"There is not indication that the law is to yield for pedestrians in non-light crosswalks. As a walker I'm pissed when someone doesn't stop, as a driver I'm terrified of being rear-ended by someone who doesn't realize I'm stopping at a crosswalk! Crosswalk requires lights embedded in the street and/or flashing signage that becomes illuminated by a crossing pedestrian.  Drivers don't stop for pedestrians here. Agreed Agree - have stopped for pedestrians only to have other drivers pull out around me. agreed Sgree Agree I agree! This is a painted and signed crosswalk. More often than not drivers aggressively drive around pedestrians - they even swerve toward them and blow their horns. Agree! Cars zoom by and this is a heavily walked area with the businesses, library and kids book store. My husband has his chiropractic office there and I walk this area often with a huge stroller (for twins) and sadly most cars don?t stop or yield agree"
70,43,3306957238633069582202,Other,Other,2/7/2018,Wed,Map is wrong for this intersection after Grant Park was extended.,travels (other),LANG ST & WALNUT ST,Walnut St,Over-the-Rhine,
71,44,3624136930836262638322,""" src=""images/12 - Bike facility issue.png""></span>&nbsp;No Bike Facilities",No Bike Facilities,2/7/2018,Wed,"Many folks run the light at this intersection and speed making it dangerous to ride a bike in this stretch.  I live down the street and would like to ride my bike to work, but I refrain from doing so because of this danger.",bikes,EVERGREEN RIDGE DR & EVERGREEN RIDGE DR TERM W OF W GALBRAITH RD,W Galbraith Rd,Hartwell,
72,45,4259669379442597154658,Speeding,Speeding,2/7/2018,Wed,CArs fly down this road and police presence is not felt to in force regulation.,walks,DRAKE AV & CADILLAC AV,Drake Av,Oakley,
73,46,4077353103040778080948,Vehicles do not yield at crosswalks,Vehicles do not yield at crosswalks,2/7/2018,Wed,,walks,ERIE AV & MICHIGAN AV,Erie Av,Hyde Park,"Agreed. It?s ridiculous how many people race through this pedestrian area and don?t even think about stopping at the crosswalks. It?s incredibly dangerous and I have never seen a cop stop anyone doing it in the many decades I have lived here! AGREED.  Pedestrian-activated flashing lights or Red light. Agree.  Would be nice to have flashing lights on the crosswalks that would be activated by a walk button so cars get it that pedestrians have the right of way. Yes and pedestrians are not always visable stepping down from square the in-street ""yield to pedestrians"" signs are effective at slowing traffic, but the signs keep getting damaged/destroyed I agree."
80,47,3626256758336262638322,""" src=""images/05 - Red light running.png""></span>&nbsp;Vehicles run red lights or stop signs",Vehicles run red lights or stop signs,2/7/2018,Wed,Red light is run often on Galbraith at this light.,travels (other),EVERGREEN RIDGE DR & W GALBRAITH RD,Hamilton County Dr,Hartwell,
81,48,4250514532242510965751,Jaywalking,Jaywalking,2/7/2018,Wed,"Pedestrians Jwalk throughout Oakley business district, I feel partially because when at crosswalk drivers ignore pedestrians.",drives,GILMORE AV & MADISON RD,Madison Rd,Oakley,"Strongly agree. This is true, but probably partially caused by the fact that few cars yield to pedestrians in the crosswalks, especially those not at lights. Rampant jaywalking, often just feet from a crosswalk. Agree. Much Jaywalking across Madison at Rookwood/La Rosa's"
85,65,3306625276133066952682,Crosswalk Needed,Crosswalk Needed,2/7/2018,Wed,Walkers from the south of McMicken are more likely to jaywalk to the southern side of Elder than cross on the north side of the street.,walks,E ELDER ST & HAMER ST,E McMicken Av,Over-the-Rhine,
86,66,3624136930836262638322,""" src=""images/06 - Speeding.png""></span>&nbsp;Speeding",Speeding,2/7/2018,Wed,I witness speeding here on a daily basis on my commute to work.,drives,EVERGREEN RIDGE DR & EVERGREEN RIDGE DR TERM W OF W GALBRAITH RD,W Galbraith Rd,Hartwell,
87,67,2796109319628064622925,Speeding,Speeding,2/7/2018,Wed,Belmont regularly has cars speeding 10-20MPH over the limit. There isn't fantastic visibility at many of these intersections as well. It's not unusual to see cars crossing the double yellow line to speed around slower vehicles.,walks,OAKWOOD AV & BELMONT AV,Belmont Av,College Hill,"All utility pole & signs in front of our home which occupies block of Belmont between Cedar &Oakwood have been hit multiple times. 3 of our stone columns (16 ft from curb  toppled and destroyed) and 4  iron fence sect. damaged.  PedXwalk is hazardous Speeding is horrible here and there are a lot of accidents I completely agree with speeding and passing on a yellow line. I have been rear-ended trying to enter my driveway. Also especially at night and when the weather warms up, motorcyclists drive at a speed which is ridiculously excessive."
90,68,3317359839233173968167,Vehicles do not yield at crosswalks,Vehicles do not yield at crosswalks,2/7/2018,Wed,,walks,RUTH LYONS LN & E 7TH ST,Ruth Lyons Ln,Downtown,"It's quite dangerous here when there's no policeman directing traffic I have noticed this as well. Bumpouts along 7th street, narrower lanes, and other road diet techniques would make it clear to motorists that pedestrians are valued in this space."
92,69,4250099501942503365232,""" src=""images/09 - Failure to yield while turning.png""></span>&nbsp;Vehicles do not yield at crosswalks",Vehicles do not yield at crosswalks,2/7/2018,Wed,Signed and painted crosswalk on both sides of the esplanade are very dangerous. Drivers do not stop or even slow for pedestrians. Occasionally they will sound their horns and/or speed up.,walks,DRAKEWOOD DR & MARKBREIT AV,Madison Rd,Oakley,Agree. Have stopped for pedestrians here only to have other drivers pull out around me. lower the speed limit sooner on the approach to the square? Pedestrians are not safe at this crossing.  Cars barrel down Madison at or over the speed limit.   Find a way to make it safer for pedestrians:  a middle barrier which would protect pedestrian?  more lighted signage with bold coloring? agree
96,70,4253284639542636797097,Other,Other,2/7/2018,Wed,Cars illegally turning in and out of the Heritage at Oakley Square apartment complex. This is causing issues during rush hour commutes as well as walkers/runners in the area.,drives,RIDGE AV & CARDIFF AV,Ridge Av,Oakley,This isn't specific to Oakley.  Bicyclists riding at night wearing dark clothing is a big problem.  And the bicycle doesn't even have a rear light!  The bicyclists want the right to ride on the streets but often don't obey the rules of the road.
97,71,2805704197628059901087,Speeding,Speeding,2/7/2018,Wed,"Drivers speeding up Kirby often cross into on-coming traffic, resulting in wrecks and driving up onto the sidewalk (you can always see the tire marks). This is especially concerning as this is how we get to our child's bus stop.",walks,GLENVIEW AV & MERYTON PL,Glenview Av,College Hill,"I agree. 35 to 50 is common in this 25 section OP - I referred to drivers speeding up Kirby, I was referring to Glenview."
99,72,4076761255440771602834,Lack of Visibility,Lack of Visibility,2/7/2018,Wed,As you exit Larosa's parking lot there is no visibility to pedestrians in the sidewalk.,drives,ZUMSTEIN AV & MADISON RD,Madison Rd,Hyde Park,
100,73,3357625820433576697978,Vehicles do not yield at crosswalks,Vehicles do not yield at crosswalks,2/7/2018,Wed,,walks,GANO ST & WALNUT ST,Walnut St,Downtown,Agree
101,74,4750976679147511956601,Vehicles run red lights or stop signs,Vehicles run red lights or stop signs,2/7/2018,Wed,Drivers often roll or even speed through the 4-way stop at Erie and Roe. I notice this most often during the morning commute 8-9:30.,drives,ROE ST & ERIE AV,Roe St,Madisonville,I have observed this corner for eight years as my children get on and off the bus here. Most cars roll through the stop sign and some don?t stop at all. Horrifying.
102,75,4239561500642301466338,""" src=""images/14 - Other issue.png""></span>&nbsp;Other",Other,2/7/2018,Wed,bicycles do no obey any rights of way.  bike paths should be removed from the street.  bikes create a hazard for pedestrians and cars.,drives,NASH AV & NASH AV TERM W OF NANCY LN,Delta Av,Mt. Lookout,I drive here regularly and have never seen bikers not obeying the rules of the road. We need more bike lanes and driver education about cyclists. Wrong. Slow down and stay out of the bike lane. Can you please give more detail?
105,76,3306957238633069582202,No Bike Facilities,No Bike Facilities,2/7/2018,Wed,Red Bike dock or other bike facilities are lacking in this area,bikes,LANG ST & WALNUT ST,Walnut St,Over-the-Rhine,
106,77,2384348402023847234300,Vehicles run red lights or stop signs,Vehicles run red lights or stop signs,2/7/2018,Wed,"The traffic light is too long for vehicles on Fischer turning onto Harrison. Frequently see vehicles run red light. Vehicles also catch red light at Harrison and Werk, it takes 6+ mins to get through the area.",drives,FISCHER PL & HARRISON AV,Fischer Pl,Westwood,the red light is too long. the timing needs to change Running red lights and moving before red light turns green ... this is out of control. And to be completely honest there is a pattern for who does this. Yesterday a young man ran a light that was red for almost 3 seconds.  The law applies to all.
108,78,4244190139542443791369,Vehicles run red lights or stop signs,Vehicles run red lights or stop signs,2/7/2018,Wed,vehicles turn left constantly during posted no left turn time restrictions.   large number of vehicles turn on red during school hours.,walks,PINEHURST AV & ERIE AV,Erie Av,Hyde Park,Agree
109,79,2805704197627958393244,Lack of Visibility,Lack of Visibility,2/7/2018,Wed,Fence and hedge at properties on the corner of Glenview and Belmont impede drivers' ability to see oncoming traffic when turning left or right onto Belmont.,drives,GLENVIEW AV & BELMONT AV,Glenview Av,College Hill,Visibility is dangerous here with the fence and hedge on either side of Glenview. Cars speeding up the hill on Belmont do not help the issue. I agree that the large fence on one side of the intersection impedes the view of the driver turning left from Glenview to Belmont. I have seen an increase in near misses since this fence was installed. It is dangerous to turn right onto Belmont from the right lane on Glenview. The view of traffic coming from the left is reduced by the hill and further obscured by any large vehicle in the left turning lane. Traffic too fast on Belmont. There should be a stop light here.  Too many speeding vehicles on Belmont and it seems folks have to pull out into intersection (from Glenview) to see if there is oncoming traffic
113,80,2538048505525383934905,No Sidewalks,No Sidewalks,2/7/2018,Wed,"There is an extreme lack of sidewalks along Westwood Northern Blvd.  In most areas, they only exist on one side of the street, or not at all.  With a lack of crosswalks, it makes crossing to get to/from the sidewalk extremely dangerous.",drives,WESTWOOD NORTHERN BLVD & BRODBECK PL,Westwood Northern Blvd,Westwood,I agree
114,81,3359067821533594838284,Vehicles do not yield at crosswalks,Vehicles do not yield at crosswalks,2/7/2018,Wed,,walks,E 6TH ST & BROADWAY,E 6th St,Downtown,
115,82,4253854517642539205851,Vehicles run red lights or stop signs,Vehicles run red lights or stop signs,2/7/2018,Wed,,walks,SHEREL LN & PAXTON AV,Sherel Ln,Oakley,
116,83,4254103515242541996122,Vehicles run red lights or stop signs,Vehicles run red lights or stop signs,2/7/2018,Wed,,walks,PILLARS DR & PAXTON AV,Pillars Dr,Oakley,
117,84,2805704197627958393244,Speeding,Speeding,2/7/2018,Wed,,walks,GLENVIEW AV & BELMONT AV,Glenview Av,College Hill,Agree! Not safe to walk or drive here Agreed
119,85,4254351512742544466137,Vehicles run red lights or stop signs,Vehicles run red lights or stop signs,2/7/2018,Wed,,walks,PAXTON AV & JORA LN,Jora Ln,Oakley,
120,86,4254351512742545995106,Vehicles run red lights or stop signs,Vehicles run red lights or stop signs,2/7/2018,Wed,,walks,PAXTON AV & CLUB VIEW DR,Paxton Av,Oakley,
121,87,4254912517645450255724,Vehicles run red lights or stop signs,Vehicles run red lights or stop signs,2/7/2018,Wed,,walks,PAXTON WOODS DR & PAXTON AV,Paxton Woods Dr,Oakley,
122,88,4702944456547029614048,Jaywalking,Jaywalking,2/7/2018,Wed,"Mt. Washington is getting more shops and restaurants, but there is no crosswalk along Beechmont at the Goodwill/Wendy?s/Sweets and Meats section, & pedestrians cross every 2 minutes. Only place to cross Beechmont is two blocks down at Corbly.",drives,PLAZA AV & BEECHMONT AV,Beechmont Av,Mt. Washington,"Agree.. people are constantly crossing Beechmont Avenue at Roxbury .. either they need to enforce the Jay walking law here, or make a pedestrian crossing Beechmont needs a serious road diet. i agree Beechmont needs a road diet We see people jaywalking this area with small children all the time. They are not going to walk two blocks up to cross and walk back down. Businesses are in this area and there needs to be a crosswalk to support the increase in pedestrians in area. I agree there's a problem here. DEFINITELY need a painted crosswalk at Crestview or Roxbury.  It's dumb to expect someone to walk all the way up to Corbly.  Traffic moves so quickly (illegally here).  Needs to be dealt with. I agree there is a huge problem here! There are a number of pedestrians who cross quickly and safely, but others meander and often wait  in the left turn lane.  Drivers exceeding the speed limit by 20+ mph is also a major problem. A painted crosswalk at this location will encourage crossing at a very dangerous section of Beechmont.  It will give false impression of safety.  Safe and proper crossing is only 1/2 block south at Beechmont/Corbly"
