index,REQUESTID,STRSEGID,REQUESTTYP,Request_type,REQUESTDAT,Day,COMMENTS,USERTYPE,NEAR_INTER,NEAR_STR,SNA_NAME,0
1015,615,3266329715132663827632,Lack of Visibility,Lack of Visibility,2/8/2018,Thu,"The intersection of Clifton Avenue and Lafayette is extremely dangerous for pedestrians trying to cross Clifton. The curve on Clifton north of the intersection blocks visibility of cars traveling south, and there is no crosswalk marked.",walks,LAFAYETTE CIR & LAFAYETTE AV,Clifton Av,Clifton,"PLEASE either put a stoplight at Lafayette or aggressively ticket drivers who speed around this end. agree a cross walk would be great but it will need flashing lights for cars coming up hill so that they are prepared to stop I agree, a crosswalk is needed here or nearby. very difficult and dangerous to cross clifton avenue on foot and no crosswalk in sight. It is equally dangerious to try to pull out on to Clifton Avenue becauese of the lack of visibility to the north Need a crosswalk here. We regularly cross with our small children, it is harrowing. People do need to cross the street somewhere on Clifton Ave.   There is no cross walk within 1/2 to 3/4 mile of this intersection.  We need help from Traffic Engineering on the best place to put a crossing. Because it is a dangerous intersection, it is EXACTLY the place for a crosswalk No one should be crossing Clifton at this point.  This would be a horrible place for a crosswalk."
1023,606,3225830356532359452929,Speeding,Speeding,2/8/2018,Thu,"I commute to Cincinnati State almost every day, and people FLY down Winton hill. People pass me like I'm standing still, it's insane. It's the worst (as far as I know) 630 to 7 in the morning.",drives,WINTON RD & WINTON RIDGE LN,Winton Ridge Ln,Winton Hills,I agree
1024,607,4754586506147546105322,No Sidewalks,No Sidewalks,2/8/2018,Thu,"There are no sidewalks on Marietta and a lot of kids who live in this neighborhood. It's easy to get to the park using this street, but people often speed. A sidewalk would be much better.",walks,PALMETTO ST & BLANEY AV,Blaney Av,Madisonville,
1025,608,4753757457547537794877,No Sidewalks,No Sidewalks,2/8/2018,Thu,This is a path to the park but there are no sidwalks.,walks,SETTLE ST & BRAMBLE AV,Settle St,Madisonville,agree
1026,625,4752932496547537794877,Crosswalk Needed,Crosswalk Needed,2/8/2018,Thu,"People speed down Bramble, and in order to get to the bike trail you have to get cross to get to Settle. Crossing feels really dangerous. There should be a crosswalk that is here or from Marietta.",walks,SETTLE ST & BRAMBLE AV,Bramble Av,Madisonville,
1027,626,2381546537323820215331,Crosswalk Needed,Crosswalk Needed,2/8/2018,Thu,,walks,MONTANA AV & BOUDINOT AV,Montana Av,Westwood,I agree I agree directly across from park
1029,616,2381090541323815465373,Vehicles do not yield at crosswalks,Vehicles do not yield at crosswalks,2/8/2018,Thu,,walks,MONTANA AV & CHEVIOT AV,Montana Av,Westwood,"The cars drive insanely fast. Lots of kids including mine cross here but I know it?s a matter of time before someone gets killed Strongly agree with previous comments. Cars coming from Boudinot come up the hill too fast and pedestrians and bicyclist already in the crosswalk are in extreme danger. Needs a four way stop- even with the signs and playground signs, people ignore the crosswalk or try to go around the cars that do actually stop. I agree! This is true needs better visibility like flashing lights"
1034,617,4754363624847543976550,No Sidewalks,No Sidewalks,2/8/2018,Thu,There is no reason why the streets that run north/south in Madisonville should not have sidewalks.,walks,JAMESON ST & BUCKINGHAM PL,Jameson St,Madisonville,
1035,618,4098324281040987562567,Vehicles do not yield at crosswalks,Vehicles do not yield at crosswalks,2/8/2018,Thu,"Too often southbound cars on Delta turning left/outbound on Columbia Pkwy, do not yield to pedestrians. I've been clipped once and nearly hit at least two more times.
Also, the walk light is too short.",walks,COLUMBIA PKWY & DELTA AV,Columbia Pkwy,East End,"I agree. Problem is because cars turning left off Delta cant see oncoming traffic due to the lane configuration.  Thus, more focused on cars coming opposite direction than pedestrians.  Intersection needs either a left arrow or deddicated left lane I agree!  As a parent of a student that catches the bus to/from school at this corner, I?ve been horrified at the way drivers speed around this corner without regard for pedestrians in the crosswalk. Agree. As a runner in the area, I have been almost hit here more times than I can count."
1038,627,3008605022830087759234,Other,Other,2/8/2018,Thu,"The sidewalk from Northbend to Spring Grove consistently has debris on it, and the construction crews using it as their storage place for the past month hasn't helped. When I bike down to college, it's like a obstacle course.",bikes,SOUTHRIDGE LN & TOWERWOODS DR,Hamilton Av,College Hill,
1039,619,4221108325942219082271,No Sidewalks,No Sidewalks,2/8/2018,Thu,,walks,VINEYARD PL & TUSCULUM AV,Vineyard Pl,Mt. Lookout,I agree I agree!
1041,628,3028229703530182446673,Speeding,Speeding,2/8/2018,Thu,The Speed limit is 25 between here and Meredith. It's common to see cars doing 45 or more through here,bikes,HAMILTON AV & HOLLYWOOD AV,Hamilton Av,College Hill,I agree! I agree. I agree
1044,629,4220741216042212081737,Other,Other,2/8/2018,Thu,Sidewalk bordering Alms Park/park land is unusable - drainage and/or hillside slippage makes sidewalk dangerous at best.,walks,ALMS PARK DR & TUSCULUM AV,Tusculum Av,Columbia Tusculum,Agreed!
1045,630,3361049166533610921317,Other,Other,2/8/2018,Thu,Cars traveling East on Elsinore Pl intending to turn left (North) on Gilbert don't seem to know to yield to oncoming traffic (traveling from Elsinore Ave West on Elsinore Pl). I think there should be a left turn signal traffic light.,drives,ELSINORE AV & ELSINORE PL,Elsinore Av,Mt. Adams,
1046,631,2978378956129785459162,Other,Other,2/8/2018,Thu,"Traveling east on Colerain to the fork at Blue Rock,  there is a traffic light for the lane to Blue Rock, and 2 lights for the 1 lane staying on Colerain, making it seem like there are 2 lanes to Colerain, when there is only 1 lane.",drives,COLERAIN AV & BLUE ROCK ST,Colerain Av,Northside,
1047,620,3839336915338306629103,Speeding,Speeding,2/8/2018,Thu,"Cars  fly down the street so fast you cannot get their plate or sometimes even model of car. I walk and cross the street, many times with an infant in my arms.",walks,HEREFORD ST & BURNS AV,Hereford St,Hartwell,
1048,632,3306619129633066711000,Speeding,Speeding,2/8/2018,Thu,"People drive recklessly. Tonight alone, around 6:30 pm, someone actually sped past me illegally in the oncoming traffic lane and I witnessed two u-turns in the middle of this block of vine.",drives,E 15TH ST & W 15TH ST,Vine St,Over-the-Rhine,
1049,621,2815441768729971515100,Speeding,Speeding,2/8/2018,Thu,Common to see 45 or more in this 35 section.,bikes,KIRBY AV & MEHMERT AV,Kirby Av,Mt. Airy,
1050,622,3315962964933159939456,Long wait for walk signal,Long wait for walk signal,2/8/2018,Thu,,walks,ERICH KUNZEL WY & ELM ST,Elm St,Over-the-Rhine,
1051,633,3275178531032761205201,Vehicles run red lights or stop signs,Vehicles run red lights or stop signs,2/8/2018,Thu,,walks,MIDDLETON AV & MCALPIN AV,McAlpin Av,Clifton,4 way stop. Coming up or down mc alpine or Middleton- many cars don?t seem to want to stop I agree
1053,634,3316868911233168958948,Parking on the sidewalk,Parking on the sidewalk,2/8/2018,Thu,Parking your SUV on the sidewalk is the epitome of conspicuous consumption.,walks,DOERR AL & W 9TH ST,Doerr Al,Downtown,I agree
1054,623,3751399588840845625093,Speeding,Speeding,2/8/2018,Thu,"People speed on Columbia Parkway often.  Because of the heavy traffic and lack of shoulders, this type of aggressive driving is unsafe and should be monitored regularly.",drives,HOFF AV & HOFF AV TERM W OF ST ANDREWS ST,Columbia Pkwy,Hyde Park,agree wholeheartedly.
1055,635,3347953633933480165958,Parking on the sidewalk,Parking on the sidewalk,2/8/2018,Thu,Haven't we suburbanized the riverfront enough?  Parking on the sidewalk in this location needs to end.,walks,E FREEDOM WY & WALNUT ST,Walnut St,Downtown,The vehicles on the sidewalk/plaza are embarrassing. Agreed!  Freedom Center CONSTANTLY has cars parked on the sidewalk.  This is illegal.  Sometimes cars block the main sidewalk on Walnut Street. Agree
1058,636,2812844647328137505791,Speeding,Speeding,2/8/2018,Thu,"People drive as if this road is a small highway.  It's very dangerous when pulling in/out of drives, including going to mt. airy forest.",drives,BLUE SPRUCE RD & FURNAS RIDGE RD,Colerain Av,Mt. Airy,
1059,637,3362950212937135362220,Crosswalk Needed,Crosswalk Needed,2/8/2018,Thu,"There was a crosswalk here before they redid the conservatory some years back. I have repeatedly asked our neighborhood liaisons (not Current ones) to look into the problem, no luck.",bikes,EDEN PARK DR & MARTIN DR,Eden Park Dr,Walnut Hills,Agree Agree. Need crosswalk. A little paint would go a long way. Speed limits need to be enforced. Cars race through Eden Park.
1061,624,4282532657742827996749,Parking too close to intersection,Parking too close to intersection,2/8/2018,Thu,"When cars park in either side of Webbland Place it?s difficulit to see oncoming traffic.  Trucks making deliveries completely block view and any other tall vehicles. Also, traffic gets backed up around 5 making difficult to get on or out of Webbland.",drives,WEBBLAND PL & MONTGOMERY RD,Montgomery Rd,Pleasant Ridge,Agreed
1062,638,3352567918833528409399,Vehicles do not yield at crosswalks,Vehicles do not yield at crosswalks,2/8/2018,Thu,One of the most difficult areas to merge to Columbia Pkwy traffic. Really?,drives,E 3RD ST TO COLUMBIA EB PKWY RAMP & FT WSHNGTN EB TO COLUMBIA EB RAMP,Martin Dr,East End,
1063,639,2811286538028124266281,Other,Other,2/8/2018,Thu,Mt. Airy Forest is a beautiful park I frequently attend but sometimes feel unsafe as I've seen several drug deals in parking lots in warmer weather. Also trash and broken glass in parking lots. Monitor more closely.,walks,BLUE SPRUCE RD & ARBORETUM RD,Blue Spruce Rd,Mt. Airy,
1064,641,4547823453245487764682,Other,Other,2/8/2018,Thu,"I'd rather have a colonoscopy than to try and navigate Erie/Redbank on foot.  Unless Cincinnati and Fairfax work this out, we will continue to have to walk 10X as far as necessary in order to get through this ""fiefdoms on steroids"" intersection.",walks,ERIE AV BRIDGE & RED BANK RD,Erie Av,Madisonville,Agree
1065,640,4282250639642825326577,Vehicles run red lights or stop signs,Vehicles run red lights or stop signs,2/8/2018,Thu,"Drivers turning left from westbound Montgomery Rd onto southbound Ridge will continue to turn left even after the green left turn arrow has expired, especially during morning and evening rush hour.",drives,RIDGE AV & MONTGOMERY RD,Montgomery Rd,Pleasant Ridge,
1066,642,3352842982437230350394,Speeding,Speeding,2/8/2018,Thu,"If  you get here on the riverside, you're stuck. No way to cross street with Martin st. traffic coming in both directions, and hidden by curves in road.",walks,HILL ST & MARTIN DR,Martin Dr,Walnut Hills,
1067,657,3324810663033256215869,Other,Other,2/8/2018,Thu,The left turn lane inductive loop for the traffic light is not sensitive enough for bikes. I need to be right on the outside wire and lean the wheel all the way down so my rim is almost touching the road to trigger it.,bikes,W 2ND ST BRIDGE & OPEN LAND,Ft Wshngtn Eb Wy To W 2Nd St Ramp,Downtown,
1068,643,4283012689142834277173,Speeding,Speeding,2/8/2018,Thu,"In both directions of Montgomery Rd, if you are driving at 25-30 MPH, you will get tailgated or passed. This imperils drivers and pedestrians from Pleasant Ridge through Kennedy Heights and Silverton.",drives,MONTGOMERY RD & WOODMONT AV,Montgomery Rd,Pleasant Ridge,I agree
1069,658,3323488622633235616809,Other,Other,2/8/2018,Thu,A bike cannot get this light to turn green.,bikes,W 3RD ST & LINN ST,Gest St,Queensgate,
1070,659,3294873790232953467860,Vehicles do not yield at crosswalks,Vehicles do not yield at crosswalks,2/8/2018,Thu,vehicles turning from Straight St. north onto Clifton frequently fail to see pedestrians or do not want to wait for them crossing and cut the turn close.,walks,STRATFORD AV & STRAIGHT ST,Straight St,CUF,
1071,660,4079328272142495642697,Crosswalk Needed,Crosswalk Needed,2/8/2018,Thu,"I would like to see a crosswalk somewhere across Wasson, near HPA/Drake. Many students from HP school and St. Mary cross there daily.",walks,MONTEITH AV & WASSON RD,Wasson Rd,Oakley,I agree
1072,644,3285495927332855289596,Jaywalking,Jaywalking,2/8/2018,Thu,"This area of Clifton Ave is a nightmare because UC students jaywalk. Even though there is a cross walk on the south side of the intersection, many try to cross on the north, or really anywhere along Clifton",drives,CLIFTON CT & SWISS CHALET CT,Clifton Av,CUF,"A crosswalk is needed on the north side of the Clifton Court intersection, or even better, probasco! Poor traffic design encourages jaywalking in this heavy pedestrian area. Agree. Clearly crosswalks are needed for safe crossing."
1075,645,2961683473932721674634,No Sidewalks,No Sidewalks,2/8/2018,Thu,"Students from Cristo de Rey school walk on Clifton Hills Avenue to get to the bus stops on Ludlow, but there are no sidewalks and visibility is poor especially at night.",walks,CLIFTON CREST TER & CLIFTON HILLS TER,Clifton Hills Av,Clifton,I agree. I agree.  Walking in the street before sunrise is very dangerous.  Sidewalks are needed.
1077,646,2960769419029616834739,Lack of Visibility,Lack of Visibility,2/8/2018,Thu,"No sidewalks and hard to see people walking in street, especially at night, because of the hill and curves",walks,CLIFTON CREST TER & CLIFTON HILLS TER,Clifton Hills Av,Clifton,
1078,661,2970382021029706570174,Speeding,Speeding,2/8/2018,Thu,Crosswalk with a four way stop needed,walks,CHASE AV & LANGLAND ST,Chase Av,Northside,
1079,662,4099186206440994201532,Vehicles run red lights or stop signs,Vehicles run red lights or stop signs,2/8/2018,Thu,"Most of the time cars run this red light, resulting in accidents for vehicles leaving gas station who also pull out quickly as soon as the light turns red.",drives,COLUMBIA PKWY & STANLEY AV,Columbia Pkwy,East End,"No traffic laws are followed at this intersection.  Illegal left turns into Speedway back up traffic on Columbia Pkwy and Stanley.  Illegal left turn onto Columbia Pkwy from Stanley put drivers and pedestrian's at risk.  Cars go through red light. All driving rules are ignored.  It seems to be every driver for himself b/c of lack of policing. I agree.  In addition, there is a no left turn into the Speedway from Stanley which is consistently ignored."
1082,663,4099186206440994201532,Speeding,Speeding,2/8/2018,Thu,Typical to come to a complete stop to make a left into my driveway.  I'm afraid of being rear ended.  Drivers are speeding and distracted.  Been many close calls.,drives,COLUMBIA PKWY & TUSCULUM AV,Columbia Pkwy,Columbia Tusculum,I agree.  Speeding is a big issue in our neighborhood.
1083,647,4098619177040989001203,Vehicles do not yield at crosswalks,Vehicles do not yield at crosswalks,2/8/2018,Thu,,walks,TUSCULUM AV & EASTERN AV,Eastern Av,East End,Agree I don?t know what it is about this intersection but I?ve almost been hit many times.
1085,648,4109284077542195700448,Vehicles do not yield at crosswalks,Vehicles do not yield at crosswalks,2/8/2018,Thu,,walks,DONHAM AV & EASTERN AV,Eastern Av,East End,Agree
1086,664,2981152112429812861129,Crosswalk Needed,Crosswalk Needed,2/8/2018,Thu,"A four way stop is a needed change here. This is a prime crossing for children going to the playground and walking to/from school. There is poor visibility down the through street Pullan, which cars travel fast down.",walks,PULLAN AV & FERGUS ST,Pullan Av,Northside,
1087,665,2971250078329812861129,Lack of Visibility,Lack of Visibility,2/8/2018,Thu,"A four way stop is a needed change here. This is a prime crossing for children going to the playground and walking to/from school. There is poor visibility down the through street Pullan, which cars travel fast down.",drives,PULLAN AV & FERGUS ST,Fergus St,Northside,
1088,666,3397571344633878582568,Vehicles do not yield at crosswalks,Vehicles do not yield at crosswalks,2/8/2018,Thu,"south-bound Vine cars turning onto Ruther.  Cross from inside lane to outside lane, barrel straight-away at full speed.  Difficult for pedestrians;  cars don't ever indicate they are turning by either slowing or a turn signal",walks,RUTHER AV & GLENMARY AV,Ruther Av,CUF,"Outrageous speeding, lack of signaling or stopping when headed up Ruther. This happens regularly - vehicles ignore pedestrians in cross walk and they do not stop.  Very dangerous."
1090,465,4691664929446917259529,Lack of Visibility,Lack of Visibility,2/7/2018,Wed,Turning from Glade onto Sutton is hazardous.  Vehicles routinely block visibility of oncoming traffic.,drives,SUTTON AV & GLADE AV,Sutton Av,Mt. Washington,I Agree!! I Agree I agree. I agree.
1094,451,3315993945633160259300,""" src=""images/09 - Failure to yield while turning.png""></span>&nbsp;Vehicles do not yield at crosswalks",Vehicles do not yield at crosswalks,2/7/2018,Wed,,walks,ERICH KUNZEL WY & ELM ST,Elm St,Downtown,
1095,452,3369039347533693363445,Crosswalk Needed,Crosswalk Needed,2/7/2018,Wed,There is a crosswalk on one side of the street (the east side) but none on the west. Additional signage and additional crosswalk on the west side would improve visibility. Perhaps also one of those paddles in the center of the street.,walks,YOUNG ST & DORCHESTER AV,Dorchester Av,Mt. Auburn,There needs to be a 4 way stop sign at the intersection of Dorchester and Young.  Vehicles FLY up and down this road.  It is dangerous to try and cross Dorchester at this point (driving and walking).  The speed limit also is not very visibly posted.
1096,453,3306205371133063473796,Long wait for walk signal,Long wait for walk signal,2/7/2018,Wed,This intersection is notorious for being a long wait. Most people jaywalk out of frustration. It needs to be more responsive to pedestrians.,walks,W CLIFTON AV & VINE ST,Peete St,Over-the-Rhine,I agree
1097,454,3306133313133063033129,Long wait for walk signal,Long wait for walk signal,2/7/2018,Wed,This intersection is notorious for being a long wait. Most people jaywalk out of frustration. It needs to be more responsive to pedestrians.,walks,FINDLAY ST & VINE ST,Findlay St,Over-the-Rhine,
1098,455,4079051255240791062743,Crosswalk Needed,Crosswalk Needed,2/7/2018,Wed,,walks,HYDE PARK AV & WASSON RD,Hyde Park Av,Oakley,Agree! I agree! Crosswalk needed desperately! Agreed. It?s becoming really difficult to cross here. Agreed! It?s impossible!
1102,466,3718434474637598325292,Speeding,Speeding,2/7/2018,Wed,"riverside drive from bain st. to the underpass is two lanes,reducing to one.cars race to beat cars inthe other lane. very speeds.Especially bad at rush hour",drives,RIVERSIDE DR & VANCE ST,Riverside Dr,East End,Speeding is out of control.  Sometimes drivers ignore a stop sign or red light and whiz on through.
1103,467,3307306268633074182786,Lack of Visibility,Lack of Visibility,2/7/2018,Wed,Cars going up Lang have to stop at a very steep slope and wait for Mulberry traffic to pass. Many go through this intersection quickly to avoid stopping on the steep slope. Switching the stop signs to affect Mulberry would make a safer intersection.,drives,LANG ST & MULBERRY ST,Lang St,Over-the-Rhine,A stop sign for Mulberry would help the Lang intersection greatly. This is a relatively high speed area with few stops.
1104,468,4702939484347032904845,Crosswalk Needed,Crosswalk Needed,2/7/2018,Wed,"Safe crossing from the bus stop to SVDP is needed here and not up at Corbly. The sidewalks are horrible in the winter for wheelchairs, strollers and pedestrians!",uses an assistive device,BEECHMONT AV & ROXBURY ST,Roxbury St,Mt. Washington,cross walk needed IN ADDITION to the one at Corbly Crosswalk def needed at Roxbury or Plaza
1106,469,3379375719833794027480,Vehicles do not yield at crosswalks,Vehicles do not yield at crosswalks,2/7/2018,Wed,The street is too fast. Pedestrians cross at their own risk as cars race down Wm Howard Taft. Flashing lights when a pedestrian is crossing would be great to alert drivers. Constant flashing will quickly be ignored.,drives,EDEN AV & WILLIAM H TAFT RD,Eden Av,Corryville,
1107,456,3306067177333062101759,Speeding,Speeding,2/7/2018,Wed,Cars constantly go way above the speed limit and endanger the lives of residents.,walks,GOOSE AL & W LIBERTY ST,W Liberty St,Over-the-Rhine,
1108,457,3828985546538201885742,Vehicles run red lights or stop signs,Vehicles run red lights or stop signs,2/7/2018,Wed,this happens on a regular basis.,drives,DE CAMP AV & WOODBINE AV,De Camp Av,Hartwell,
1109,470,3317486905033575438702,Vehicles do not yield at crosswalks,Vehicles do not yield at crosswalks,2/7/2018,Wed,"Some drivers race around the corner when the light changes--maybe don't realize pedestrians just got a ""go"" signal, too.",walks,E 8TH ST & WALNUT ST,Walnut St,Downtown,Part of the problem is that vehicles are not prohibited from turning right on red from Southbound Walnut to Westbound 8th street
1110,471,4703290484547032904089,No Sidewalks,No Sidewalks,2/7/2018,Wed,"Walking with my small child on Beechmont scares me because the vehicles are speeding, but I cannot use this side RESIDENTIAL street comfortably either because it doesn't have sidewalks.",walks,CORBLY ST & SALVADOR ST,Salvador St,Mt. Washington,This road sincerely needs sidewalks I agree. This should be high priority as it is in walking distance to a Cincinnati public school from a neighborhood in the Cincinnati school district. Keep our kids safe!
1112,458,3828985546538201885742,Parking too close to intersection,Parking too close to intersection,2/7/2018,Wed,this used car lot consistently parks cars in NO PARKING areas.,drives,DE CAMP AV & VINE ST,De Camp Av,Hartwell,
1113,459,3316614857733167478556,Parking on the sidewalk,Parking on the sidewalk,2/7/2018,Wed,"Motorcycles are sometimes parked on the sidewalk, blocking access.",walks,BALDWIN AL & GARFIELD PL,Garfield Pl,Downtown,
1114,472,4702939484347029444565,Speeding,Speeding,2/7/2018,Wed,"Drivers speed excessively from Corbly all the way down the hill. I turn at this intersection frequently and it is dangerous when vehicles behind you swerve into the other lane to maintain speed (and yes, I use a turn signal properly)",drives,BEECHMONT AV & ROXBURY ST,Beechmont Av,Mt. Washington,"Speeding is an issue all over the business district but particularly here. The speed problem through the MW cc NBD is aggregious. The street needs to be redesigned. Speeding a problem here... would love to see what top speeds are.  No reason to slow down until Corbly  when coming up hill after Ranchvale/Redfield.  Going down hill, everyone hits gas at Corbly. Speeding is a huge issue here (believe other two commenters meant to mark 5 stars) Agreed- people go WAY too fast down this hill- very hard to turn here and hard to see pedestrians trying to play Frogger crossing the street! I agree. I walk up and down the hill from Redfield Place to Corbly and the speed, especially downhill and during rush hour, takes my breath away. Am pretty sure some folks are doing 70mph and it's a 35mph zone."
1120,473,3316956859333170838637,Other,Other,2/7/2018,Wed,I thought businesses had to remove snow and ice. This area has been bad lately.,walks,DOERR AL & GARFIELD PL,Garfield Pl,Downtown,
1121,474,4079119274140692664280,Speeding,Speeding,2/7/2018,Wed,Cars fly down this residential street at 40+ mph,walks,ANDREW PL & ANDREW PL TERM E OF ANDREW AV,Hyde Park Av,Oakley,I agree Agreed. There are lots of small children and pedestrians on this street Agreed! People fly down the street without regard for the many small children who live there.
1124,460,3347953633933480165958,""" src=""images/09 - Failure to yield while turning.png""></span>&nbsp;Vehicles do not yield at crosswalks",Vehicles do not yield at crosswalks,2/7/2018,Wed,,walks,E 2ND ST & WALNUT ST,Walnut St,Downtown,
1125,475,3316766843033167898296,Other,Other,2/7/2018,Wed,"Not sure who decided bars along this block should have big outdoor seating areas, but they make it challenging for walking at busy times. These same businesses don't seem to care about removing snow and ice from what is left of the sidewalks.",walks,BALDWIN AL & W 7TH ST,Baldwin Al,Downtown,
1126,476,3357752746133578267059,""" src=""images/04 - Crossing away from crosswalks.png""></span>&nbsp;Jaywalking",Jaywalking,2/7/2018,Wed,,drives,WALNUT ST & E 5TH ST,Walnut St,Downtown,
1127,477,3347904660333479536339,""" src=""images/09 - Failure to yield while turning.png""></span>&nbsp;Vehicles do not yield at crosswalks",Vehicles do not yield at crosswalks,2/7/2018,Wed,,walks,WALNUT ST & E 3RD ST,Walnut St,Downtown,
1128,461,3347904660333479536339,""" src=""images/14 - Other issue.png""></span>&nbsp;Other",Other,2/7/2018,Wed,Cars do not stay in their lane when turning.,drives,WALNUT ST & E 3RD ST,Walnut St,Downtown,
1129,462,4702939484347032904845,Lack of Visibility,Lack of Visibility,2/7/2018,Wed,There is a yield sign here instead of a stop sign with no clear vision either way without stopping.,drives,SALVADOR ST & ROXBURY ST,Roxbury St,Mt. Washington,
1130,463,3327445652333479046603,""" src=""images/05 - Red light running.png""></span>&nbsp;Vehicles run red lights or stop signs",Vehicles run red lights or stop signs,2/7/2018,Wed,People are flying down 3rd and constantly running red lights.,walks,WALNUT ST & E 3RD ST,E 3rd St,Downtown,
