index,REQUESTID,STRSEGID,REQUESTTYP,Request_type,REQUESTDAT,Day,COMMENTS,USERTYPE,NEAR_INTER,NEAR_STR,SNA_NAME,0
3086,5833,2402214577724023555503,Speeding,Speeding,3/7/2018,Wed,Cars go way to fast over speed limit,walks,WESTERN HILLS AV & N OVERLOOK AV,Glenway Av,West Price Hill,
3087,5834,2412798464024129854282,Parking on the sidewalk,Parking on the sidewalk,3/7/2018,Wed,Sidewalk on glenwa y inbound to town is blocked by cars visiting businesses,walks,RELLEUM AV & GLENWAY AV,Glenway Av,West Price Hill,
3088,5835,2412845261924132943857,Other,Other,3/7/2018,Wed,A stop sign is needed on overlook going towards rapid run because they speed and cars coming off Loretta are at great risk,travels (other),OVERLOOK AV & LORETTA AV,Overlook Av,West Price Hill,
3089,5836,2402043611424023146103,Jaywalking,Jaywalking,3/7/2018,Wed,"Students ignore no crossing sings, they think it's funny to risk their lives and that of others they cross at any time over glenwa y even when all lights on glenwa y are green",travels (other),PROSPERITY PL & SIDNEY RD,Prosperity Pl,West Price Hill,
3090,5837,2401591700724016556878,Jaywalking,Jaywalking,3/7/2018,Wed,Students have no concern for safety,drives,FERGUSON PL & GLENWAY AV,Glenway Av,West Price Hill,I try to avoid this area when West Hi gets out. Perhaps a crosswalk for the students would be helpful or moving the bus stop so they won't cross in the middle of the street.?
3091,5838,2412985428224132943857,Other,Other,3/7/2018,Wed,recuring pot hole because of metal access cover not properly installed,drives,GUERLEY RD & CLEVES WARSAW PIKE,Glenway Av,West Price Hill,
3092,5839,2412985428224132943857,Vehicles do not yield at crosswalks,Vehicles do not yield at crosswalks,3/7/2018,Wed,Get drivers off cell phones so they look at what they are doing my grandkids a nd kids want me around,travels (other),OVERLOOK AV & GLENWAY AV,Glenway Av,West Price Hill,
3093,5840,2415152254225063863748,Other,Other,3/7/2018,Wed,Here's or chains need to block entrance to parks kit at after hours because to much sex and drugs are going on in lot and park at night police do not patrol enough!,travels (other),RAPID RUN PIKE & RUTLEDGE AV,Rapid Run Pike,West Price Hill,
3094,5862,4099420153242104219944,Speeding,Speeding,3/7/2018,Wed,"Speeding on Columbia Pky here is rampant. The long timing of this light contributes to it. I will wait for more than 2 minutes on Tusculum for it to change. When it finally does, it's very short causing people to speed to catch it before it turns red",drives,COLUMBIA PKWY & TUSCULUM AV,Columbia Pkwy,East End,
3095,5851,3285251230632852832605,Parking too close to intersection,Parking too close to intersection,3/7/2018,Wed,,drives,ORMOND AV & HOWELL AV,Ormond Av,Clifton,I agree- a constant issue on this corner
3096,5852,3283981278432845352715,Parking too close to intersection,Parking too close to intersection,3/7/2018,Wed,,walks,HOWELL AV & WHITFIELD AV,Howell Av,Clifton,
3097,5853,3272465549032735995620,No Bike Facilities,No Bike Facilities,3/7/2018,Wed,"a protected bike lane or path coming uphill would be useful as it would connect to state college and northside bike paths, and avoid Ludlow high street.",bikes,DURBAN DR & MCALPIN AV,McAlpin Av,Clifton,
3098,5863,3276137533033981895084,No Bike Facilities,No Bike Facilities,3/7/2018,Wed,"the bike path  i sneeded on BOTH sides of the road, then continuing up Forest Ave to Zoo and Hospitals",bikes,GREEN HILL AV & GREENDALE AV,Woolper Av,Clifton,
3099,5873,2971454893529718578894,Other,Other,3/7/2018,Wed,"on street in front of motoshop here is public parking but the business uses it constantly to move vehicles on and off their lot, if anyone else parks there, they ask them to move- it's public parking on street- the conflict is a safety issue.",drives,SPRING GROVE AV & CHAMBERS ST,Spring Grove Av,Northside,
3100,5854,3273599531032751785490,Speeding,Speeding,3/7/2018,Wed,"cars travelling down McAlpin accelerate, making it dangerous for bikes and pedestrians to cross",walks,WOOD AV & WOOD AV TERM W OF MIDDLETON AV,McAlpin Av,Clifton,
3101,5855,2961777551232721234714,Lack of Visibility,Lack of Visibility,3/7/2018,Wed,Bus stop is too close to intersection. Cars frequently have to go around the buses that make extended stops in order to turn right onto Lafayette and then get cut off by the bus that starts to move.,drives,LAFAYETTE AV & OLD LUDLOW AV,Ludlow Av,Clifton,Pedestrians crossing Lafayette and Ludlow from bus stop are also more difficult to see when traffic is forced to go around the waiting bus.  Would love to see this bus stop moved across Lafayette or up Ludlow a bit.
3102,5889,3284535271532745723148,Other,Other,3/8/2018,Thu,UC shuttles stop for passenger pickup/drop off immediately after turning left onto Whitfield from westbound Ludlow.  Shuttle should do that down the block to avoid stopping traffic in the intersection.,travels (other),LUDLOW AV & WHITFIELD AV,Whitfield Av,Clifton,
3103,5905,3018264592130197295743,Speeding,Speeding,3/8/2018,Thu,,walks,HAMILTON AV & PEASLEE AV,Wittekind Ter,College Hill,
3104,5906,3018264592130197295743,Parking too close to intersection,Parking too close to intersection,3/8/2018,Thu,,drives,HAMILTON AV & PEASLEE AV,Wittekind Ter,College Hill,
3105,5921,3018256630630197816092,Parking on the sidewalk,Parking on the sidewalk,3/8/2018,Thu,,walks,HARBESON AV & TEAKWOOD AV,Teakwood Av,College Hill,"Homeowners park in their driveway, but block the sidewalk consistently. Impassible with wheelchairs, strollers, and causes a hazard with pedestrians forced to walk in the street."
3106,5907,3010823448430108795076,Lack of Visibility,Lack of Visibility,3/8/2018,Thu,Bushes blocking view,drives,FAIRCREST DR & W NORTH BEND RD,Edwood Av,College Hill,I agree!
3107,5908,3018255621930182645921,Speeding,Speeding,3/8/2018,Thu,,walks,HAMILTON AV & PEASLEE AV,Hamilton Av,College Hill,
3108,5922,3018244667330182446536,Speeding,Speeding,3/8/2018,Thu,,walks,BIRCHWOOD AV & HAMILTON AV,Hamilton Av,College Hill,
3109,5909,3018264592130182755600,Lack of Visibility,Lack of Visibility,3/8/2018,Thu,Cars parked along street block the view of side streets and heavy speeding in this area. Cars whip around parked cars here and it is near impossible to turn South on Hamilton from Wittekind.,drives,HAMILTON AV & PEASLEE AV,Hamilton Av,College Hill,
3110,5910,3018255621930182645921,Other,Other,3/8/2018,Thu,"Street sign torn down and laying in the front yard of resident. Believe it is a ""no parking"" sign...",drives,HARBESON AV & TEAKWOOD AV,Hamilton Av,College Hill,
3111,5911,3381135139533817451335,Parking too close to intersection,Parking too close to intersection,3/8/2018,Thu,,drives,BURNET AV & KASOTA ST,Kasota St,Avondale,
3112,5923,3381745133533817751611,Parking too close to intersection,Parking too close to intersection,3/8/2018,Thu,,drives,HARVEY AV & KASOTA ST,Harvey Av,Avondale,
3113,5912,3380659134633810900997,Crosswalk Needed,Crosswalk Needed,3/8/2018,Thu,,walks,BURNET AV & ALBERT SABIN WY,Albert Sabin Wy,Corryville,
3114,5913,3018264592130197295743,Speeding,Speeding,3/8/2018,Thu,,walks,DEVONWOOD DR & WITTEKIND TER,Wittekind Ter,College Hill,
3115,5121,3018284431330182874065,Vehicles do not yield at crosswalks,Vehicles do not yield at crosswalks,3/1/2018,Thu,I have stopped and almost rear ended by drivers that do not see the cross walk.  More signs are needed to alert drivers similar to Northside.,drives,ELKTON PL & HAMILTON AV,Hamilton Av,College Hill,
3116,5122,3028229703530182446673,Speeding,Speeding,3/1/2018,Thu,it's 25 mph in the business district; then changes to 35 mph through the residential area of Hamilton Ave.  It then changes back to 25 mph upon entering NCH.  Speed humps through the residential area might help with that.,walks,HAMILTON AV & LARRY AV,Hamilton Av,College Hill,
3117,5123,3018256630630197816092,Parking too close to intersection,Parking too close to intersection,3/1/2018,Thu,Teakwood is a busy street - too many cars park too close to the intersection and this makes it hard to navigate that turn from Hamilton Ave.,drives,HARBESON AV & TEAKWOOD AV,Teakwood Av,College Hill,
3118,5124,3018244653630182566306,Speeding,Speeding,3/1/2018,Thu,Cars can zoom by at 60 mph during the middle of the night - drag races occur in the middle of the night sometimes.,walks,BIRCHWOOD AV & HAMILTON AV,Hamilton Av,College Hill,
3119,5125,3018264592130182755600,Speeding,Speeding,3/1/2018,Thu,Lots of speeding through this section of Hamilton Ave.,walks,REID AV & HAMILTON AV,Hamilton Av,College Hill,
3120,5126,3018379360030185343164,Other,Other,3/1/2018,Thu,"""No Parking during rush hour"" signs are not heeded or enforces.  This makes traffic during AM/PM rush hour back up for a LONG time.",drives,MARLOWE AV & HAMILTON AV,Hamilton Av,College Hill,
3121,5297,3276137533033981895084,Speeding,Speeding,3/5/2018,Mon,"I have nearly been rear-ended by people speeding as I slow with my signal to turn into my driveway countless occasions. I have often been passed on the left by other driver when signaling to turn left into my garage, nearly causing accidents.",drives,INTERVINE PL & INTERVINE PL TERM W OF VINE ST,Woolper Av,Clifton,
3122,5298,3276137533033981895084,Speeding,Speeding,3/5/2018,Mon,,walks,INTERVINE PL & INTERVINE PL TERM W OF VINE ST,Woolper Av,Clifton,+1
3123,5299,3276137533033981895084,Speeding,Speeding,3/5/2018,Mon,,drives,GREEN HILL AV & GREENDALE AV,Woolper Av,Clifton,Agree!  and with the concrete the high speed makes for high noise!
3124,5441,4282221734742822277025,Other,Other,3/5/2018,Mon,When traveling south on Ridge there is no official White and Black speed limit sign decreasing the speed limit to 25MPH as you approach the business district. The only sign now is a yellow one specific to the curve in the road.,drives,RIDGE AV & SCHUBERT AV,Ridge Av,Pleasant Ridge,I agree
3125,5457,3359603735733500077676,""" src=""images/14 - Other issue.png""></span>&nbsp;Other",Other,3/5/2018,Mon,Need a trash can on the south side of 4th street. Have to cross dangerous intersection to get to one on N side of 4th street to throw away dog waste bags.,walks,LAWRENCE ST & LUDLOW ST,E 4th St,Downtown,
3126,5473,3358356809533585888133,Vehicles run red lights or stop signs,Vehicles run red lights or stop signs,3/5/2018,Mon,Routine every weekday am for 2-3 drivers heading south to run every  red light 6th and Sycamore.,walks,E 6TH ST & SYCAMORE ST,E 6th St,Downtown,"They also run the light through Sycamore heading west on 6th, usually at a very high rate of speed (+40mph)"
3127,5793,4704883414047049895014,No Sidewalks,No Sidewalks,3/6/2018,Tue,"Our nephew (and many other Sands students) use Sussex to get to/from school, and the street is already too narrow. It needs sidewalks.",walks,COFFEY ST & SUSSEX AV,Sussex Av,Mt. Washington,
3128,5794,4693837140046939802111,Parking too close to intersection,Parking too close to intersection,3/6/2018,Tue,"Cars park too close to the Beechmont intersection, and if one car is turning onto South Wilaray when another car is waiting on Wilaray to enter Beechmont, it's a tight squeeze",drives,BEECHMONT AV & WILARAY TER,Wilaray Ter,Mt. Washington,"These cars should park on Beechmont.  Many of them are people who are visiting buildings on Beechmont who are ""afraid"" to park on Beechmont."
3129,5924,3018264592130197295743,Speeding,Speeding,3/8/2018,Thu,,walks,DEVONWOOD DR & WITTEKIND TER,Wittekind Ter,College Hill,
3130,5914,3019729574330109195531,Crosswalk Needed,Crosswalk Needed,3/8/2018,Thu,,walks,DEVONWOOD DR & WITTEKIND TER,Wittekind Ter,College Hill,
3131,5915,3266401838932672038111,Speeding,Speeding,3/8/2018,Thu,"During summer, when pool is open, drivers unfamiliar with the neighborhood speed to the facility. Many children live in the neighborhood or are travelling to the pool on foot or on bicycles.",walks,AMAZON AV & CLIFTON AV,Amazon Av,Clifton,Speeding has been an ongoing problem and needs to be addressed!!!!
3132,5916,3275261641032653607606,No Sidewalks,No Sidewalks,3/8/2018,Thu,One side of street does not have sidewalks. Lots of walkers and dog walkers in area- hard to cross the street if no sidewalks there,walks,CYPRESS GARDEN AV & CYPRESS GARDEN AV TERM W OF CLIFTON AV,Middleton Av,Clifton,The portion of Middleton with a walk on only one side is very wide. The street could be narrowed to add a walk to the side that is lacking one.
3133,5925,3266382763232672038111,No Sidewalks,No Sidewalks,3/8/2018,Thu,"The sidewalk on the west side was extended which helped tremendously. However, pedestrians get trapped on east side of clifton avenue, where sidewalk suddenly ends, forcing them to cross in a dangerous manner.",walks,AMAZON AV & CLIFTON AV,Clifton Av,Clifton,"Yes! The sidewalk abruptly ends, and there isn't a crosswalk anywhere nearby."
3134,5917,3263507704932650987530,Speeding,Speeding,3/8/2018,Thu,"Narrow road with only one sidewalk forces pedestrians into the road with fast moving traffic. Would be best to add a sidewalk on the south side and/or create a bike lane. Heavily used by foot traffic and cyclists, with Mt Storm as destination.",walks,LAFAYETTE AV & NORTH CLIFF LN,Lafayette Av,Clifton,
3135,5926,3387936084133885700739,Vehicles do not yield at crosswalks,Vehicles do not yield at crosswalks,3/8/2018,Thu,"cars do not yield to pedestrians, particularly with the separated continuous right turn lane.",walks,VINE ST & NIXON ST,Nixon St,CUF,
3136,5918,3358668765933591467746,""" src=""images/05 - Red light running.png""></span>&nbsp;Vehicles run red lights or stop signs",Vehicles run red lights or stop signs,3/8/2018,Thu,"Drivers run this red light all day every day, often when there are police working an event at Taft Theater. Also, cars often drive in excess of 40mph to get to the highway from here.",walks,SYCAMORE ST & E 5TH ST,E 5th St,Downtown,
3137,5927,3358668765933591467746,""" src=""images/01 - Not enough time to cross.png""></span>&nbsp;Walk signal is too short",Walk signal is too short,3/8/2018,Thu,This is the shortest walk signal in the city and is especially dangerous because of all the cars turning east on 5th from southbound Sycamore. I have been nearly hit and honked at constantly. Extremely vigilance is necessary at this light.,walks,SYCAMORE ST & E 5TH ST,E 5th St,Downtown,I agree. I have been almost hit 4 times in the past 30 days.
3138,5928,4704883414047049895014,No Sidewalks,No Sidewalks,3/8/2018,Thu,I would like sidewalks here.  I walk this route with my kids  and it is not safe without them.,walks,COFFEY ST & SUSSEX AV,Sussex Av,Mt. Washington,
3139,5929,3381745133533817751611,Parking too close to intersection,Parking too close to intersection,3/8/2018,Thu,Cars to close to drive exiting CCHMC Kasota building onto Harvey. Witness near-misses on an almost daily basis,drives,HARVEY AV & KASOTA ST,Harvey Av,Avondale,Agree
3140,5930,3381090099733811351395,Vehicles do not yield at crosswalks,Vehicles do not yield at crosswalks,3/8/2018,Thu,As a pedestrian I have multiple near-misses on a weekly basis crossing the street as cars are not yielding to pedestrians.,walks,BURNET AV & ALBERT SABIN WY,Burnet Av,Avondale,I agree.
3141,5919,2393038223223932012966,Vehicles do not yield at crosswalks,Vehicles do not yield at crosswalks,3/8/2018,Thu,"Vehicles do not always honor the walk light when I try to cross Werk Rd. They are hellbent on turning right from Ferguson onto Werk, no matter who is standing on the corner waiting to cross.",walks,FERGUSON RD & WERK RD,Geyer Woods Ln,Westwood,I agree Agree.
3143,5920,3723485057837239750923,Vehicles do not yield at crosswalks,Vehicles do not yield at crosswalks,3/8/2018,Thu,"As a nearby resident, I use this crosswalk multiple times a day to walk my dogs and cars from the Bains exit to Riverside either run the red light, speed through the intersection or don?t yield to the crosswalk signal.  It is very scary.",walks,BAINS ST & RIVERSIDE DR,Bains St,East End,
3144,6081,3315192865633152478400,""" src=""images/08 - Failure to yield while going straight.png""></span>&nbsp;Parking too close to intersection",Parking too close to intersection,3/8/2018,Thu,Government vehicles often park here causing traffic backups and driver frustration. This area is already marked as a NO PARKING zone!,drives,CENTRAL AV & W 8TH ST,Central Av,West End,
3145,6082,3317288744233577527461,""" src=""images/14 - Other issue.png""></span>&nbsp;Other",Other,3/8/2018,Thu,Walking and driving in downtown is generally hazardous. I propose pedestrian only area (NO CARS) from ELM to SYCAMORE and from 8TH to 4TH. Let the street car run in this area only. Designate parking outside this area. People need exercise anyway!,travels (other),W 5TH ST & VINE ST,E 5th St,Downtown,
3146,6083,3367711122333679061257,Vehicles run red lights or stop signs,Vehicles run red lights or stop signs,3/8/2018,Thu,"Cars speed up and down Vine Street in OTR and run red lights, especially in the morning.  Cars turn even though people are in the crosswalk and the walk light is on.",walks,COGSWELL AL & ENON AL,Enon Al,Over-the-Rhine,
3147,6084,3381745133533817751611,Parking too close to intersection,Parking too close to intersection,3/8/2018,Thu,"parking to close , can't see harvey at all from road",drives,HARVEY AV & KASOTA ST,Harvey Av,Avondale,
3148,5931,3381090099733811351395,Vehicles run red lights or stop signs,Vehicles run red lights or stop signs,3/8/2018,Thu,frequent running of red lights - epecially in the morning,walks,BURNET AV & ALBERT SABIN WY,Burnet Av,Corryville,
3149,5932,3693022951736941299420,Other,Other,3/8/2018,Thu,the timing of this light from i-71 south to enter MLK makes for a long wait at the next MLK light which causes traffic tie ups (people running or blocking intersection),drives,E MARTIN LUTHER KING JR DR BRIDGE & VAN BUREN AV,E Martin Luther King Jr Dr,Walnut Hills,
3150,5933,3381890960233821279578,Other,Other,3/8/2018,Thu,MLK from reading to harvey curves but other drivers do not notices the curve and continue straight causing them to swerve into other lanes,drives,BARTLE AV & E MARTIN LUTHER KING JR DR,E Martin Luther King Jr Dr,Avondale,
3151,6097,3685813598536861636349,No Bike Facilities,No Bike Facilities,3/9/2018,Fri,,bikes,READING RD & N FRED SHUTTLESWORTH CIR,Reading Rd,Avondale,
3152,6113,3389827141433805671343,""" src=""images/04 - Crossing away from crosswalks.png""></span>&nbsp;Jaywalking",Jaywalking,3/9/2018,Fri,Medical staff consistently jaywalk.,drives,ALBERT SABIN WY & LEVINE DR,Albert Sabin Wy,Corryville,
3153,6114,3381135139533811791814,Jaywalking,Jaywalking,3/9/2018,Fri,Every day people jaywalk.,drives,BURNET AV & KASOTA ST,Burnet Av,Avondale,
3154,6115,3381090099733811351395,Jaywalking,Jaywalking,3/9/2018,Fri,People jaywalk even though a cross walk is just yards away.,drives,BURNET AV & KASOTA ST,Burnet Av,Corryville,People are jaywalking because the walk signal is too short and takes too long between walk signals.  This area needs patrolled.
3155,6177,3358566991233589550151,Other,Other,3/9/2018,Fri,"Cars, cabs, uber, police, all making ""Uturn"" across Central Parkway near the front of the casino!!...See it all the time...",drives,READING RD & SPRING ST,E Central Pkwy,Pendleton,
3156,6193,4704599627047049325799,Speeding,Speeding,3/11/2018,Sun,"Cars sometimes run up on sidewalks when speeding.
Curb walks don?t offer much protection.",walks,SILVERFOX DR & CARDINAL HILL CT,S Coveyrun Ct,Mt. Washington,"Post no outlet sign for pedestrian and condo owner safety and security. Cars have been spotted at times 
cruising thru the area and picking out a potential robbery 
cite."
3157,6194,4705341498147055456100,Other,Other,3/11/2018,Sun,"Work with Reserve of Turpin Condo Assoc. to post 
Private Property signs if legal",travels (other),WALNUTVIEW CT & WALNUTVIEW CT TERM SW OF SILVERFOX DR,Kenlee Dr,Mt. Washington,
3158,6195,4705484610047055456466,Speeding,Speeding,3/11/2018,Sun,More speed limit signs need to be posted in Reserve area because of speeding,walks,KENLEE DR & COPPERLEAF LN,Kenlee Dr,Mt. Washington,
3159,6849,2884553930328846019721,Vehicles run red lights or stop signs,Vehicles run red lights or stop signs,3/12/2018,Mon,Poor signage and lack of parking restriction make people think there is no stop.,travels (other),W 8TH ST & MT HOPE AV,Mt Hope Av,East Price Hill,
3160,6850,2883663939128836999808,No Sidewalks,No Sidewalks,3/12/2018,Mon,"There is a park here, and children constantly walking in the street because of the lack of sidewalks.",travels (other),GRAND AV & W 8TH ST,Grand Av,East Price Hill,
3161,6851,2883699980828840029780,Vehicles do not yield at crosswalks,Vehicles do not yield at crosswalks,3/12/2018,Mon,Lots of near misses! Bus stop on south side blocks driver's view!,travels (other),GRAND AV & PRICE AV,Price Av,East Price Hill,
3162,6852,2883359983928836999808,Speeding,Speeding,3/12/2018,Mon,Speed limit is 25. Some cars are doing 50.,travels (other),GRAND AV & PRICE AV,Price Av,East Price Hill,
3163,6853,2883699980828838020754,Lack of Visibility,Lack of Visibility,3/12/2018,Mon,Eastbound metro buses block the driver's view of the crosswalk,travels (other),GRAND AV & PRICE AV,Grand Av,East Price Hill,
3164,6854,2882721991028830489876,Crosswalk Needed,Crosswalk Needed,3/12/2018,Mon,"Crosswalk striping needed on 4 sides. Very high number of pedestrians, particularly children in this area. Lots of near misses.",travels (other),PRICE AV & PURCELL AV,Price Av,East Price Hill,
3165,6855,2882370994428827219910,Vehicles do not yield at crosswalks,Vehicles do not yield at crosswalks,3/12/2018,Mon,Cars do not stop for pedestrians,travels (other),PRICE AV & PURCELL AV,Price Av,East Price Hill,
3166,7186,3368851165633691471624,""" src=""images/06 - Speeding.png""></span>&nbsp;Speeding",Speeding,3/14/2018,Wed,"Between Colerain & Belmont, North Bend is like another I75.  Many accidents, lots of property damage due to speeding, not negotiating curve in road. It's a dangerous stretch of road.  Wish a traffic light could be installed to slow traffic.",drives,WASHINGTON AV & HOOVEN AV,CORPORATION AL,College Hill,
3167,7187,3368109154433681461889,Speeding,Speeding,3/14/2018,Wed,People drive too fast on Winton Rd,drives,WASHINGTON AV & CHIDLAW AV,VON SEGGERN AL,Winton Hills,I agree!
3168,7188,2863048732628632427259,Vehicles do not yield at crosswalks,Vehicles do not yield at crosswalks,3/15/2018,Thu,Speeding constantly happens and folks do not yeild to pedestrians.,walks,BEREA DR & HUNT ST,WICKHAM AL,Downtown,
3169,7473,3703625596537037896329,Vehicles run red lights or stop signs,Vehicles run red lights or stop signs,3/15/2018,Thu,The light quickly changes in the morning only allowing a 3-4 cars through from Deliquia & Campus that  cars end up running the light.  If the light was green a few seconds longer for Deliquia & Campus in the mornings it would prevent this issue.,drives,HUNT ST & BEREA DR,SEDALIA AL,Mt. Washington,
3170,7474,4095965386440962133714,""" src=""images/05 - Red light running.png""></span>&nbsp;Vehicles run red lights or stop signs",Vehicles run red lights or stop signs,3/15/2018,Thu,NB/SB vehicles frequently run red lights especially when turning left.,travels (other),BRIDGETOWN RD & ASTON WOODS DR,BABB AL,North Avondale - Paddock Hills,
3171,7489,3297299722832974907249,""" src=""images/10 - Hard to see.png""></span>&nbsp;Lack of Visibility",Lack of Visibility,3/15/2018,Thu,Uneven off-center intersection with blind spots; traffic moves in both directions on green E/W & N/S,travels (other),ASTON WOODS DR & BRIDGETOWN RD,CALHOUN ST,Avondale,
3172,7825,3297488722933778777188,Speeding,Speeding,3/18/2018,Sun,"School zone 20 mph is mostly ignored, even by parents dropping off their children!!",drives,W MORGAN ST & PORTER ST,CALHOUN ST,,Agree
3173,7826,4243330148442438421435,Parking on the sidewalk,Parking on the sidewalk,3/18/2018,Sun,,travels (other),PORTER ST & W MORGAN ST,ERIE AV,West Price Hill,
3174,7827,4244190139542443791369,Parking on the sidewalk,Parking on the sidewalk,3/18/2018,Sun,,travels (other),MARKLAND ST & W MARKLAND ST,ERIE AV,West Price Hill,
3175,7828,3325205599733265586208,Vehicles run red lights or stop signs,Vehicles run red lights or stop signs,3/18/2018,Sun,,travels (other),MARKLAND ST & N MIAMI AV,I-75 NB EXWY TO FT WSHNGTN EB RAMP,West Price Hill,
3176,7829,3752176759037523157744,Parking on the sidewalk,Parking on the sidewalk,3/18/2018,Sun,,travels (other),W MARKLAND ST & MARKLAND ST,ELMHURST AV,West Price Hill,
3177,7830,0278642187402796812066,Parking on the sidewalk,Parking on the sidewalk,3/18/2018,Sun,,travels (other),W MARKLAND ST & N MIAMI AV,WINDING WY,West Price Hill,
3178,7921,0279540125902700231072,Vehicles run red lights or stop signs,Vehicles run red lights or stop signs,3/19/2018,Mon,I was almost hit just the other day at the corner of Kasota and Burnet by a car running a redlight,walks,N MIAMI AV & MARKLAND ST,RIDGEVIEW DR,Avondale,
3179,7922,2441407925424414579158,Other,Other,3/19/2018,Mon,There should be a safer path from the CCHMC Kasota Parking to the other side of the road.  UC and CCHMC employees are constantly in danger of people speeding and running red lights.  I would like to see a pedestrian overpass.,walks,N MIAMI AV & W MARKLAND ST,TYLER ST,Corryville,Agreed!
3180,7923,2853948992028542360345,Crosswalk Needed,Crosswalk Needed,3/19/2018,Mon,There is a shuttle stop across the street from the new Offices of Vernon Place.  There is a place to cross but no on street markings of a crosswalk.,walks,WESTERN RIDGE DR & WESTGATE AV,BRESTEL RD,Avondale,
3181,7953,2517817559725180575569,Other,Other,3/20/2018,Tue,Lights are poorly timed by pedestrian safety.,walks,WESTGATE AV & WESTERN RIDGE DR,HEYWARD ST,Northside,
3182,7954,2518057556925181795560,Lack of Visibility,Lack of Visibility,3/20/2018,Tue,There is a dumpster that has been sitting in the no parking zone for weeks making it nearly impossible to see cross traffic on Chase.,drives,ISLAND DR & HONEYDEW CT,HEYWARD ST,Northside,
