index,REQUESTID,STRSEGID,REQUESTTYP,Request_type,REQUESTDAT,Day,COMMENTS,USERTYPE,NEAR_INTER,NEAR_STR,SNA_NAME,0
2090,1115,3707570715237079307102,Other,Other,2/8/2018,Thu,"Due to retail property close by, this needs to require residential parking permits so residents have some place to park.",walks,CLAYTON ST & WOODBURN AV,Clayton St,East Walnut Hills,I agree!!!!
2091,1116,4283427717342838136812,Crosswalk Needed,Crosswalk Needed,2/8/2018,Thu,A crosswalk is needed for pedestrian safety at Grand Vista and Montgomery in Pleasant Ridge.,walks,MONTGOMERY RD & GRAND VISTA AV,Grand Vista Av,Pleasant Ridge,lots of people jaywalking b/c there are no other crosswalks for blocks. This is right in front of the library where many people walk to. I agree a crosswalk is needed across Montgomery at Grand Vista.
2093,1117,4282799674942830126891,Vehicles run red lights or stop signs,Vehicles run red lights or stop signs,2/8/2018,Thu,"People sometimes run through this light, which is potentially fatal since this intersection has a walk signal.  People are selfish and don't pay attention.",walks,MONTGOMERY RD & WOODMONT AV,Montgomery Rd,Pleasant Ridge,"YES- lower the light fixtures.  Coming down Montgomery towards Ridge, they blend in. I've seen many pedestrians almost get hit by a car running the light. People ALWAYS run this light Montgomery & Woodmont). It's extremely dangerous as they are coming at high speeds down the hill. The lights are really high and I think some people don't even see them. Lower the lights and making them stand out more."
2095,1118,4250243503142504855298,""" src=""images/06 - Speeding.png""></span>&nbsp;Speeding",Speeding,2/8/2018,Thu,Speed limit needs to be reduced starting at Edwards & Madison through Oakley Square.,walks,DRAKEWOOD DR & MARKBREIT AV,Madison Rd,Oakley,
2096,1119,4282243655342822506396,Speeding,Speeding,2/8/2018,Thu,"In general in and around the Pleasant Ridge business district, people speed, run lights and don't respect pedestrians.  Measures need to be taken before someone is killed.  People need consequences for their selfish driving actions.",walks,RIDGE AV & MONTGOMERY RD,Ridge Av,Pleasant Ridge,completely agree. Would like to see more ped xing signs (maybe like the ones in the road near hyde park square). agree! larger/more speed bumps or road divisions like Mt. Lookout
2098,1120,4281805815642823968207,Parking too close to intersection,Parking too close to intersection,2/8/2018,Thu,Parked cars on Beredith make it difficult to pull onto the street from Ridge when a car is coming in the opposite direction,drives,RIDGE AV & BEREDITH PL,Beredith Pl,Pleasant Ridge,
2099,1137,3367569207033677902047,Vehicles run red lights or stop signs,Vehicles run red lights or stop signs,2/8/2018,Thu,,walks,MAIN ST & SCHILLER ST,Schiller St,Over-the-Rhine,
2100,1138,3017592480930182874740,Speeding,Speeding,2/8/2018,Thu,,drives,CARY AV & W NORTH BEND RD,W North Bend Rd,College Hill,
2101,1139,2490996062428710531183,Vehicles do not yield at crosswalks,Vehicles do not yield at crosswalks,2/8/2018,Thu,"This intersection is just generally dangerous for various reasons, speeding, turning off Warsaw without yielding to pedestrians, etc.",drives,MCPHERSON AV & WARSAW AV,McPherson Av,East Price Hill,I agree!
2102,1140,4289859528342801095435,Speeding,Speeding,2/8/2018,Thu,Drivers come up Ridge Road at about 40-45mph so it is dangerous to try to turn off the residential streets especially at Norham & Bellewood. Also walkers & runners are unable to cross safely. We need a traffic light & some pedestrian crossings,drives,MONTGOMERY RD & LANGDON FARM RD,Montgomery Rd,Pleasant Ridge,agree! completely agree!
2104,1141,3316211819833166658275,Vehicles do not yield at crosswalks,Vehicles do not yield at crosswalks,2/8/2018,Thu,"The crosswalk leading to the front door of the building I live in, Shillito Lofts at 151 W 7th St., is terrifying to use. Very seldom do cars yield to pedestrians in this crosswalk.",walks,W ONEIDIA AL & W ONEIDIA AL TERM W OF RACE ST,W 7th St,Downtown,"Also, when the bus is picking up passengers, it is nearly impossible to see cars and for them to see pedestrians. It's amazing there aren't more people hit here. I second this comment. Cars treat 7th St like a speedway, especially in the AM rush hour. Flashing crossing lights and more visible crossing signs are much needed"
2106,1142,4249991265642500963750,Speeding,Speeding,2/8/2018,Thu,Cars cut through these residential streets and pay no attention to the speed limits.  The existing speed humps are too shallow to affect any change in speed.,walks,DRAKEWOOD DR & WASSON RD,Drakewood Dr,Oakley,
2107,1143,4250243503142504855298,Vehicles do not yield at crosswalks,Vehicles do not yield at crosswalks,2/8/2018,Thu,"Cars fly through here at well over 25mph, and don't even slow for the crosswalks.",walks,DRAKEWOOD DR & MARKBREIT AV,Madison Rd,Oakley,"Agree!  Need some traffic devices here like there are in Hyde Park square.  Drivers ignore this crosswalk.  Very dangerous. I agree Please use traffic calming techniques to reduce speeding and reckless driving. Reducing traffic lanes prevents drivers from jockeying for position with cars next to them, as well as reducing the distance that pedestrians must travel to safely cross. Drivers rarely yield to peds in crosswalks around Oakley Sq."
2111,1144,3705228763737056947639,Crosswalk Needed,Crosswalk Needed,2/8/2018,Thu,Mid-block street crossing from Spencer Gifted School to CRC Playground,walks,PARK AV & MYRTLE AV,Myrtle Av,Walnut Hills,Agreed.
2112,1145,3705131674437051997347,Crosswalk Needed,Crosswalk Needed,2/8/2018,Thu,Mid-block street crossing from Frederick Douglass Elementary School entrance to school garden across Park Avenue.,walks,YALE AV & PARK AV,Park Av,Walnut Hills,Agreed.
2113,1146,3703908631037046026234,Walk signal is too short,Walk signal is too short,2/8/2018,Thu,Crossing 7 lanes of Gilbert in the allotted time is difficult for older people.,walks,SEDALIA AL & E MCMILLAN ST,E McMillan St,Walnut Hills,Agree Agreed.
2115,1147,3714416426037145013693,Lack of Visibility,Lack of Visibility,2/8/2018,Thu,Exiting the stop sign heading north from Luray it's difficult to see traffic coming up Kemper.,walks,LURAY AV & NASSAU ST,Luray Av,Walnut Hills,Agree
2116,1148,3357586842933578178469,Vehicles do not yield at crosswalks,Vehicles do not yield at crosswalks,2/8/2018,Thu,"This is an unlighted crosswalk across 7th street eastbound between Walnut & Main by the Aronoff.  Visibility of the cross walk signs is an issue, they are often blocked by large parked vehicles",walks,BOWEN ST & E 7TH ST,E 7th St,Downtown,
2117,1149,3686116569636861636349,Walk signal is too short,Walk signal is too short,2/8/2018,Thu,The walk light and the signal light to cross Reading on Clifton Spring Av is too short,walks,READING RD & CLINTON SPRINGS AV,Clinton Springs Av,North Avondale - Paddock Hills,I agree i agree
2119,1150,4076374225840766722480,Crosswalk Needed,Crosswalk Needed,2/8/2018,Thu,Need crosswalk where unneeded railroad designation exists to provide pedestrians an opportunity to cross Madison Rd between the existing traffic lights on Burch and Edwards; should be equidistant to these streets to be effective.,walks,BURCH AV & MADISON RD,Madison Rd,Hyde Park,
2120,1151,4517010762445170458016,Lack of Visibility,Lack of Visibility,2/8/2018,Thu,"From Coleridge, you can't see cars traveling on Zinsle until they are in the intersection",walks,COLERIDGE AV & ZINSLE AV,Coleridge Av,Kennedy Heights,
2121,1152,1163914571011642445806,No Sidewalks,No Sidewalks,2/8/2018,Thu,No pedestrian entry to this portion of Fernbank Park.  The entrance is closed to cars but pedestrians still use it. Sidewalks or an ability for pedestrians to enter would be nice.,walks,RIVER RD & WILKENS SHORT RD,Wilkins Short Rd,Sayler Park,I agree Please add safe pedestrian access to Fernbank Park at this intersection.
2123,1169,3378775624233787795981,Parking on the sidewalk,Parking on the sidewalk,2/8/2018,Thu,,walks,AUBURN AV & E HOLLISTER ST,Auburn Av,Mt. Auburn,
2124,1170,2970266872029702788431,Vehicles do not yield at crosswalks,Vehicles do not yield at crosswalks,2/8/2018,Thu,,walks,HAMILTON AV & COSBY ST,Hamilton Av,Northside,agreed.
2125,1171,2970179005629702249893,Jaywalking,Jaywalking,2/8/2018,Thu,Many many people ignore crosswalks and jaywalk to get across the street,walks,HAMILTON AV & POPE AL,Hamilton Av,Northside,"I agree. You hear about the issues of drivers ignoring the crosswalks, but what about the pedestrians who do not use the crosswalks"
2126,1172,2988260135129883721689,Speeding,Speeding,2/8/2018,Thu,Cars going north and south speed frequently. Pulling out from this intersection often feels like taking a risk due to poor visibility of drivers coming around corner going north and speeding! Need a traffic light here!,walks,KIRBY AV & BRUCE AV,Kirby Av,Northside,
2127,1173,2383024521823834955237,Vehicles do not yield at crosswalks,Vehicles do not yield at crosswalks,2/8/2018,Thu,,walks,MONTANA AV & EPWORTH AV,Montana Av,Westwood,A pedestrian crossing indicator like I have seen in Northside at busy intersections would be a good thing to incorporate. A more permanent idea would be to bump out the sidewalk at Harrison directly across from Muse Cafe so cars are forced to merge.
2128,1174,3351531849033525759290,Lack of Visibility,Lack of Visibility,2/8/2018,Thu,The time to merge is very short and visibility is limited until the last second. Very dangerous to merge here,drives,E 3RD ST TO COLUMBIA EB PKWY RAMP & FT WSHNGTN EB TO COLUMBIA EB RAMP,Columbia Pkwy To E 3Rd St Ramp,Mt. Adams,
2129,1175,2381040488223819734836,Parking too close to intersection,Parking too close to intersection,2/8/2018,Thu,Sometimes it is hard to see as you cross over Penrose Pl. at Cheviot Ave. because cars are parked too close to the intersection. It also makes it difficult for oncoming traffic to yield on this two way road.,walks,CHEVIOT AV & PENROSE PL,Penrose Pl,Westwood,
2130,1176,3283212976032837589685,Speeding,Speeding,2/8/2018,Thu,,walks,MARSHALL AV & PROBASCO ST,Probasco St,CUF,
2131,1177,3388216979833882479924,Long wait for walk signal,Long wait for walk signal,2/8/2018,Thu,,walks,VINE ST & JEFFERSON AV,W Mlk Jr Dr To Jefferson Av Ramp,CUF,agree All lights on MLK for crossing are way too short! Also pedestrians must push button to get walk light.  Walk lights on MLK should be automatic With the red light!!!! I agree
2134,1178,4250514532242510965751,Other,Other,2/8/2018,Thu,"Drivers pulling out of parking lot to turn right onto Madison look to their left for oncoming traffic, fail to look to their right for pedestrians coming from that direction.",walks,GILMORE AV & MADISON RD,Madison Rd,Oakley,Exactly so.  Happens frequently to me.
2135,1179,3284441963332847639622,Speeding,Speeding,2/8/2018,Thu,,walks,DIGBY AV & PROBASCO ST,Probasco St,CUF,
2136,1180,3286936001732873220001,Long wait for walk signal,Long wait for walk signal,2/8/2018,Thu,,walks,BURNET WOODS DR & WOODSIDE DR,W Martin Luther King Jr Dr,CUF,
2137,1181,3358164880933584638856,Vehicles run red lights or stop signs,Vehicles run red lights or stop signs,2/8/2018,Thu,Drivers heading west on 8th and south on Sycamore routinely run solid red lights early morning. Almost hit a pedestrian in crosswalk on 8th this morning.,bikes,E 8TH ST & SYCAMORE ST,E 8th St,Downtown,
2138,1182,4694518173246950721359,Vehicles do not yield at crosswalks,Vehicles do not yield at crosswalks,2/8/2018,Thu,Cars often almost hit pedestrians at this intersection (and have hit a woman here) - they don't wait for people to cross in the crosswalk when the light turns green.,walks,BEECHMONT AV & BEACON ST,Beechmont Av,Mt. Washington,"Agrer Really dangerous car and pedestrian intersection This is a really bad intersection, especially trying to turn left! This intersection terrible for pedestrians.  Those turning right  are so busy looking left for oncoming traffic, they accelerate while turning and come close to hitting people crossing with the walk light.  Have been yelled at for being in way. Drivers seem to ignore all driving rules.  They ignore pedestrians. I use this intersection often and totally agree!!! There are sooo many times I've almost been hit while properly using the cross walk. the drivers turning from Beacon to Beechmont just don't look"
2144,1183,4250514532242510965751,Other,Other,2/8/2018,Thu,"Since Allston now one way, drivers cut thru CVS lot to get to Madison, often cutting across the lot ignoring painted lanes, or going to turn right by ATM (not look for pedestrians)",walks,GILMORE AV & MADISON RD,Madison Rd,Oakley,
2145,1184,3006625254130072731535,Speeding,Speeding,2/8/2018,Thu,Speeding is a problem all along Belmont. I have seen speeding cars passing cars that are going the speed limit.,walks,LARCH AV & BELMONT AV,Belmont Av,College Hill,
2146,1201,3007538196730075952501,Speeding,Speeding,2/8/2018,Thu,,walks,LLANFAIR AV & WINTROP AV,Wintrop Av,College Hill,
2147,1202,3255949342332559833797,Other,Other,2/8/2018,Thu,There is no cross walk nor any pedestrian walking signs at this location.. There is a bus stop across the steer and cars do not yield for pedestrians..,walks,WINTON RD & MCMAKIN AV,Winton Rd,Spring Grove Village,
2148,1203,4547228416245478234532,Other,Other,2/8/2018,Thu,Drivers inbound veering right on to Rosslyn do not yield to cyclists and pedestrians continuing straight on Erie during AM/PM rush hours,bikes,ROSSLYN DR & ERIE AV,Erie Av,Oakley,
2149,1204,3266172063232667260566,Vehicles do not yield at crosswalks,Vehicles do not yield at crosswalks,2/8/2018,Thu,"I can not count the times i have almost been hit trying to cross the street in the cross walk..
I have reported this to district 5 and they always tell me there is nothing they can do about it..

It is extremely dangerous",walks,STATION AV & SPRING GROVE AV,Spring Grove Av,Spring Grove Village,"I agree.  I have stopped at this cross walk for pedestrians to cross, and other cars go around me"
2150,1205,3008775923429989096216,Speeding,Speeding,2/8/2018,Thu,I drive this route multiple times a day and go the speed limit. I usually have someone right on my tail. Have been flipped off etc....Cars are usually going 50 + mph and are not staying in their lanes.,drives,SOUTHRIDGE LN & TOWERWOODS DR,Hamilton Av,College Hill,
2151,1617,3273274375432737863512,Crosswalk Needed,Crosswalk Needed,2/10/2018,Sat,,walks,MORRISON AV & MORRISON PL,Ludlow Av,Clifton,I agree Absolutely a crosswalk and a traffic light is desperately needed? the speed limit appears to be 70 mph on Ludlow? it?s dangerous to walk  even on the sidewalks with drivers illegally speeding up and down this street I agree. I agree.
2155,1633,4075396205640756451718,Long wait for walk signal,Long wait for walk signal,2/10/2018,Sat,,walks,KENDALL AV & MADISON RD,Kendall Av,Hyde Park,"Agreed! If the walk button is pushed, it should give the walk signal with much less wait. High traffic area, but if someone is at the crosswalk, they deserve to cross without inordinate wait times."
2156,1634,4220632307842208573317,Speeding,Speeding,2/10/2018,Sat,People fly down Stanley Ave. It is a matter of time that a pedestrian gets hit crossing the street. Something has to be done.,walks,STANLEY LN & STANLEY AV,Stanley Av,Columbia Tusculum,The cost City of Cincinnati is charging for this area with no traffic control on a 25mph zone on Stanley Avenue is robbery at this point. Not to mention the garbage left all around from the construction workers. I recently moved on Stanley Avenue. It is a 25mph zone. Cars absolutely fly up and down this street at high speeds. I have never seen a Cincinnati police officer one single time since I have lived here. Speed bumps or a 3 way stop at Handman !!! ?? I agree that the speeding is dangerous
2159,1635,4099186206440994202166,Speeding,Speeding,2/10/2018,Sat,"People fly up and down Stanley at speeds well above the posted limits, it?s becoming dangerous to try and cross streets or access your car parked on the street",walks,WOODBRIDGE PL & STANLEY AV,Stanley Av,Columbia Tusculum,I agree!
2160,1636,4221093348542214403853,Vehicles run red lights or stop signs,Vehicles run red lights or stop signs,2/10/2018,Sat,"Stop sign on Stanley heading south-west at Vineyard Place.  Vehicles run this stop sign.  Roadway crests a hill, pedestrians below the sign are not visible.  ""Traffic from right does not stop"" is misinterpreted.",walks,VINEYARD PL & STANLEY AV,Stanley Av,Columbia Tusculum,
2161,1637,3351010005233610921317,Lack of Visibility,Lack of Visibility,2/10/2018,Sat,,drives,ELSINORE AV & VAN METER ST,Elsinore Av,Walnut Hills,Stop sign needed for cars coming down hill . Van Meter should have right of way with no stop...Elsinore should have stop sign..
2163,1638,2069480027823903630709,Speeding,Speeding,2/10/2018,Sat,"Too many cars speed on Midway, which is next to a heavily used park and residences. One kid just got hit here recently.",walks,TIMRICK CT & MOUNTVILLE DR,Midway Av,Westwood,
2164,1665,4282250639642825326577,Other,Other,2/10/2018,Sat,Vehicles cut through the Sunoco station and/or the Walgreen's parking lot to avoid stopping at red lights at Montgomery and Woodmont.,walks,RIDGE AV & MONTGOMERY RD,Montgomery Rd,Pleasant Ridge,"Pedestrians fail to respect crosswalks, walking under green lights for autos."
2165,1639,4077290025040773531030,Other,Other,2/10/2018,Sat,The turn lane vs the lane that goes straight up Edwards is rarely followed.  The lanes need to be marked more clearly as drivers in the turn only lanes consistently go straight.,drives,OBSERVATORY AV & EDWARDS RD,Edwards Rd,Hyde Park,Vehicles are constantly running red lights and not yielding to pedestrians.
2166,1640,4098874314340994883756,Speeding,Speeding,2/10/2018,Sat,Cars speed up and down Hoge St at all hours of the day. It makes me very nervous to go on walks with my child and/or pet because people are so reckless. Im also very scared to pull out of my driveway.  The residents on Hoge would love a speed bump!,walks,MISSOURI AV & NEWELL PL,Hoge St,Columbia Tusculum,"I agree wholeheartedly.  I have a suspicion that some of the cars speeding on Hoge St. may actually be the mechanics at the nearby auto shop testing cars they're working on. As a home owner on Athens Ave, I witness cars daily that speed Hoge and continue their excessive speeds on Athens Ave, a street on which many children live and play. I agree! Speed bumps would help curb the speeding I agree Agreed I agree The speeding needs to be stoppef Agree Agree I agree! Very dangerous Yes! Terrible speeders Agree.  Speeding is a safety concern on Hoge I agree I agree I agree!"
2181,1666,4077533291240675583119,Vehicles run red lights or stop signs,Vehicles run red lights or stop signs,2/10/2018,Sat,The left turn arrow from Edwards to Madison is way too short. Cars run the red to get more than two cars through at a time.,bikes,EDWARDS RD & MADISON RD,Edwards Rd,Oakley,Agree!
2182,1667,4067558311940679913390,Vehicles run red lights or stop signs,Vehicles run red lights or stop signs,2/10/2018,Sat,Need a left turn signal from Madison onto Edwards.,drives,EDWARDS RD & MADISON RD,Madison Rd,Oakley,
2183,1668,4240362275042428392413,Lack of Visibility,Lack of Visibility,2/10/2018,Sat,A left turn signal onto Paxton would be great here.  It is hard to see cars coming head on.,drives,PAXTON AV & WASSON RD,Wasson Rd,Oakley,
2184,1669,4067991339040780432857,Lack of Visibility,Lack of Visibility,2/10/2018,Sat,Lack of visibility turning onto Wasson from Michigan,drives,WASSON RD & MICHIGAN AV,Michigan Av,Oakley,
2185,1670,4086900622840869626885,Speeding,Speeding,2/10/2018,Sat,Cars fly down Edwards all the time.  We need a speed trap set up to stop it.  The speed bumps do little to stop the speeding.  I hear cars bottom out all the time on the speed bumps.,walks,LOWER GRANDIN RD & EDWARDS RD,Edwards Rd,Hyde Park,
2186,1671,4085026713340854257002,Other,Other,2/10/2018,Sat,Sidewalks are too narrow.  Very dangerous place to walk with all the speeding cars.,walks,GRANDIN RD & CORBIN DR,Grandin Rd,Hyde Park,agree
2187,1672,3751435589337515406385,Other,Other,2/10/2018,Sat,Turn signal from Torrence to Columbia Parkway is too short in the afternoon from 3pm to 5pm. I've waited 15 minutes to get through the light.,drives,COLUMBIA PKWY & WILLIAM H TAFT RD,Torrence Pkwy,Hyde Park,
2188,1641,4244844132345551121297,Vehicles do not yield at crosswalks,Vehicles do not yield at crosswalks,2/10/2018,Sat,"People speed around this bend on Erie and do not yield to pedestrians. With 4 lanes to cross, it?s scary not know if people will stop.",walks,AULT PARK AV & ERIE AV,Erie Av,Hyde Park,
2189,1642,2941659595732920885138,Other,Other,2/10/2018,Sat,"The Mockbee encourages customers to park in the bike lane, forcing cyclists into the traffic lanes, and has consistently mocked cyclists who have spoken with them about a resolution. A few tow trucks on a Saturday night would go a long way.",bikes,BRIGHTON BRIDGE APPROACH BRIDGE & CENTRAL PKWY,Central Pkwy,West End,
2190,1673,4244844132345551121297,Speeding,Speeding,2/10/2018,Sat,,walks,AULT PARK AV & ERIE AV,Erie Av,Hyde Park,
2191,1674,3348016595833480495735,Double Parking,Double Parking,2/10/2018,Sat,"Uber and taxi drivers routinely stop here next to Yard House to pick up / drop off passengers. The area is marked as no parking and no stopping.

A solution would be to mark part of Freedom Way as a taxi stand on weekend nights.",drives,E FREEDOM WY & WALNUT ST,Walnut St,Downtown,
2192,1643,4099488375642296033700,Speeding,Speeding,2/10/2018,Sat,People accelerate at this 4 way intersection making it very dangerous for many kids who live there. People also come up and UTurn to park on hoge causing dangerous situations. It happens approx 20 times a day,walks,ATHENS AV & RUSHTON RD,Rushton Rd,Columbia Tusculum,"I agree. As a mother of two young children, the speeding cars and illegal u turns make it a dangerous place to have to cross the street with my kids. Agree Very dangerous I agree! I agree! Agree!!!! Agree"
2200,1675,3315883011533159239882,No Bike Facilities,No Bike Facilities,2/10/2018,Sat,"This section of Elm street is completely unusable by bicycle because of the bricks. Please DO NOT remove the bricks, but please designate the sidewalk along Washington Park as a multi-use path.",bikes,ERICH KUNZEL WY & GRANT ST,Elm St,Over-the-Rhine,
2201,1676,4230902692442310017243,Vehicles run red lights or stop signs,Vehicles run red lights or stop signs,2/10/2018,Sat,People don?t see the crosswalk light and often run right through them,walks,DELTA AV & LOOKOUT LN,Linwood Av,Hyde Park,Agree with assessment.  Lights are too high.  Driver focus is on other vehicles and visual distractions of square.  Consider lights to side on pole or in-pavement crosswalk lights. I agree - very hard to see especially since traffic lights are very high up in the air - probably so trucks can fit underneath - suggest adding traffic signals on side inside of over top.
2203,1644,4098324281040985993299,No Bike Facilities,No Bike Facilities,2/10/2018,Sat,"The southbound bike lane on Delta ends here, spitting bicycles into the right lane. However, bicycles cannot turn right onto Columbia Pkwy, so they must negotiate with speeding cars to move left.",bikes,COLUMBIA PKWY & DELTA AV,Delta Av,Hyde Park,"I agree that the way the bike lane ends is silly; however, it's honestly not very difficult to signal and move into the lane to the left before the bike lane disappears. Agree! A painted bike lane between the lanes (such as at the bottom of the ludlow viaduct from clifton to northside would be great and improve bike lane visibility to traffic."
2205,1677,4272131478542725284753,Vehicles run red lights or stop signs,Vehicles run red lights or stop signs,2/10/2018,Sat,9 out of 10 cars roll right through the stop sign on Norham Ave. where it dead ends into Pandora Ave.,walks,PANDORA AV & NORHAM AV,Norham Av,Pleasant Ridge,
2206,1645,3708418830836985009124,Speeding,Speeding,2/10/2018,Sat,"My daughter and several others catch the bus at Hackberry and Dexter, and people have been known to blow through that intersection at 50mph (in spite of a crosswalk). We need a 4-way stop.",walks,DESALES LN & HACKBERRY ST,Hackberry St,Evanston,
2207,1678,3768806909137691599055,Speeding,Speeding,2/10/2018,Sat,"Dangerous 2-way stop. Excessive speeds in an area with a lot of walkers, school children, and cyclists.",walks,FAIRFIELD AV & DEXTER AV,Dexter Av,Evanston,
2208,1646,3769159905537695349015,Vehicles run red lights or stop signs,Vehicles run red lights or stop signs,2/10/2018,Sat,,walks,FAIRFIELD AV & DEXTER AV,Dexter Av,Evanston,
2209,1647,3769534901537501628946,No Sidewalks,No Sidewalks,2/10/2018,Sat,,walks,WOLD AV & DEXTER AV,Dexter Av,East Walnut Hills,
2210,1679,3303681460633040304323,Jaywalking,Jaywalking,2/10/2018,Sat,K,travels (other),CENTRAL AV & STARK ST,Central Pkwy,West End,
2211,1680,2978278062429786360504,Vehicles do not yield at crosswalks,Vehicles do not yield at crosswalks,2/10/2018,Sat,"Besides not yielding to pedestrians in the crosswalk in front of St. Boniface at the intersection of Chase Ave and Pitts, vehicles travel way too fast down Chase Ave.",walks,PITTS AV & CHASE AV,Chase Av,Northside,
2212,1648,3357525015633577550194,Vehicles run red lights or stop signs,Vehicles run red lights or stop signs,2/11/2018,Sun,Cars turn left onto 12th from Clay without stopping,walks,E 12TH ST & CLAY ST,E 12th St,Over-the-Rhine,
2213,1713,3307357112333675891162,Vehicles run red lights or stop signs,Vehicles run red lights or stop signs,2/11/2018,Sun,Cars do not stop at stop sign heading east on 14th at Clay,bikes,E 14TH ST & CLAY ST,E 14th St,Over-the-Rhine,
